230,CN,A,CN 104068517 A,042-897-454-963-569,2014-10-01,2014,CN 201410300132 A,2014-06-30,CN 201410300132 A,2014-06-30,Bamboo fiber textile fabric electric arc protective clothing,"The invention relates to bamboo fiber textile fabric electric arc protective clothing. The bamboo fiber textile fabric electric arc protective clothing comprises a clothing body, and a flame-retardant material is added into the clothing material of the clothing body. The bamboo fiber textile fabric electric arc protective clothing is made by the steps of padding in flame-retardant finishing liquor (room temperature), preliminary drying, ammonia fumigating, oxidizing and water washing, drying and pre-shrinking. A layer of base cloth layer is compounded on the back side of the clothing body; the base cloth layer comprises base cloth interwoven by using warps and wefts; the warps and the wefts are made by blending bamboo fibers and organic cotton fibers; one surface of the base cloth is coated with an active carbon power or bamboo charcoal powder layer; the other surface of the base cloth is coated with a far infrared coating. By adopting the bamboo fiber textile fabric electric arc protective clothing, hurt to human skin due to contact with electric arc heat energy is lowered to the maximum extent, the blood circulation of human body can be promoted, and metabolism can be adjusted.",JIANGYIN GUORUN TEXTILE RAW MATERIALS SALES CO LTD,CHEN GUOYIN,,https://lens.org/042-897-454-963-569,Patent Application,no,0,1,1,042-897-454-963-569,CN,1,042-897-454-963-569,CN,0,,A41D13/008;;A41D31/02;;B32B27/02;;B32B27/12;;B32B33/00,,0,0,,,,DISCONTINUED
231,DE,U1,DE 20121982 U1,076-422-356-743-735,2003-10-16,2003,DE 20121982 U,2001-05-19,DE 20121982 U;;DE 10124467 A,2001-05-19,"Insulating material for building components, consists of lambs wool or at least 10wt% lambs wool, as well as other fibres","An insulating material which can be blown into building component sections, consists of lambs wool or at least 10 wt% lambs wool, as well as other fibres, chosen from eg hemp, coconut, jute, flax, cellulose, wood, glass wool and/or stone wool. The fibres are 5-30mm long, and contain a fire retardant.",GROBE CARSTEN;;KARGER JUERGEN;;KRUSCHE MATTHIAS;;STEEGEMANN ERICH,,,https://lens.org/076-422-356-743-735,Limited Patent,no,0,0,1,076-422-356-743-735,DE,3,076-422-356-743-735;;028-657-587-986-772;;025-555-627-907-842,DE,0,E04B1/7604;;E04B2001/743;;E04B2001/745;;Y02A30/244,E04B1/74;;E04B1/76,,0,0,,,,EXPIRED
232,KR,B1,KR 101604071 B1,073-478-884-136-326,2016-03-16,2016,KR 20150086678 A,2015-06-18,KR 20150086678 A,2015-06-18,FLOOR STRUCTURES AND CONSTRUCTION METHOD USING HEMP AND OCHER,"The present invention relates to a floor structure using hemp cloth and ocher and a construction method thereof. In a state in which glass fiber, an aluminum thin plate, and natural textile are sequentially stacked and bonded, an ocher layer is applied to form integrated flooring to enhance durability to minimize delamination and cracks. When the floor is heated, the aluminum thin plate having fine air pores facilitates heat conduction properties to maximize heating efficiency. In addition, by embedding and fixing a separator in an ocher mortar layer, a floor board is constructed on one side and flooring is constructed on the other side, widening selection of floor structures to enhance merchantability.",HYUNDAI IND DEV & CONSTR CO;;SAMMIN IND CO LTD,JEONG MUN YEONG;;BAIK HO;;YU JONG SU;;HONG JONG CHUL;;KIM SEONG EUN;;SIN YONG SOON,,https://lens.org/073-478-884-136-326,Granted Patent,no,0,4,1,073-478-884-136-326,KR,1,073-478-884-136-326,KR,0,,E04F15/12,,0,0,,,,ACTIVE
233,CN,A,CN 102733184 A,084-574-828-817-273,2012-10-17,2012,CN 201210248936 A,2012-07-18,CN 201210248936 A,2012-07-18,Finishing technology for aromatic anti-bacteria cotton textile,"The invention discloses finishing technology for aromatic anti-bacteria cotton textile, which comprises the steps of extraction of active matters of plants, preparation of natural germicide and chitosan cross-linking and finishing technology of the cotton textile; finished knitted or machine-made cotton textile has long-time aroma and has health-care effect such as broad-spectrum bacteriostasis, sterilization, desinsectization and the like; in addition, the cotton textile disclosed by the invention has very good washability; and the cotton textile can be prepared as a plurality of knitted or machine-made health-care fabrics such as bras, underwear, pants, pajamas, pillowcases, bed sheets and the like.",UNIV NANTONG,YAN GE;;JIAPENG TANG;;SHANQING XU;;HONG TANG;;LUYUAN XU;;HAIHONG FU;;YITING LIU,"JIANGSU SANFONDO TEXTILE BIO-TECHNOLOGY CO., LTD. (2014-04-10)",https://lens.org/084-574-828-817-273,Patent Application,no,3,32,2,153-862-842-837-454;;084-574-828-817-273,CN,2,153-862-842-837-454;;084-574-828-817-273,CN,0,,D06M13/00;;D06M11/70;;D06M13/207;;D06M15/00;;D06M15/03;;D06M101/06,,4,0,,,"《染整技术》 20100430 侯燕等 ""壳聚糖/柠檬酸对棉织物的防皱防臭整理"" 第35-38页 1-6 第32卷, 第4期;;《针织工业》 20050930 邓兵等 ""壳聚糖对棉针织物的抗菌整理研究"" 第52-54页 1-6 , 第9期;;侯燕等: ""“壳聚糖/柠檬酸对棉织物的防皱防臭整理”"", 《染整技术》;;邓兵等: ""“壳聚糖对棉针织物的抗菌整理研究”"", 《针织工业》",ACTIVE
234,WO,A1,WO 2014/040098 A1,081-712-063-822-68X,2014-03-20,2014,AT 2013000147 W,2013-09-11,AT 10122012 A,2012-09-17,"SPUN-DYED MODAL FIBRES, USE THEREOF AND PROCESS FOR PRODUCTION THEREOF","The present invention relates to a spun-dyed cellulosic regenerate fibre which achieves the definition of modal, to the use thereof for production of yarns and fabrics, for textile and industrial applications, and to a process for producing these fibres. The inventive spun-dyed modal fibres are suitable for textile applications in industrial sectors such as, for example, automobile textiles, furniture, carpets, curtains and transport textiles. These fibres meet all demands on fibres for industrial textiles, for example high strength in the wet state, high rub-fastness in the wet state, high high-temperature light-fastness, and also the demands of industrial laundry. The fibres can be produced in various titre ranges, according to the product use. The invention thus enables the use of cellulosic fibres in all sectors in which spun-dyed viscose fibres are not used. The inventive spun-dyed modal fibres are equally suitable both for the clothing sector and for domestic textiles.",CHEMIEFASER LENZING AG,VARGA KSENIJA;;KRONER GERT;;WESSELY PETER;;KAEMPF KARIN;;SCHLEUCHARDT BERNDT;;TAYLOR JAMES MARTIN;;LASSL ANDREAS;;JARY SUSANNE;;CRNOJA-COSIC MARINA;;SUCHOMEL FRIEDRICH,,https://lens.org/081-712-063-822-68X,Patent Application,yes,5,11,3,141-539-682-829-635;;066-237-584-750-796;;081-712-063-822-68X,TW;;WO;;AT,3,141-539-682-829-635;;066-237-584-750-796;;081-712-063-822-68X,TW;;WO;;AT,0,D01F2/06;;D01F2/14,D01F1/04;;D01F2/00;;D01F2/06,,3,0,,,"SZEGÖ, L., FASERFORSCH. TEXT. TECHN., vol. 21, no. 10, 1970;;LENZING AG; R. RAUCHENZAUNER, NEUE ENTWICKLUNGEN BEI SPINNGEFÄRBTEN VISKOSEFASERN; LENZINGER BERICHTE, vol. 53, 1982, pages 14 - 17;;K. GÖTZE, CHEMIEFASERN, 1951, pages 175",PENDING
235,FR,A1,FR 2190958 A1,127-544-808-567-167,1974-02-01,1974,FR 7322821 A,1973-06-22,BR 418572 A,1972-06-27,Blended fibres - esp for sacks etc,"A blended yarn forming a very effective substitute for jute and other natural fibres is produced by folding a natural jute, sisal or other yarn with a ribbon- or raffia-form polypropylene yarn to obtain a product with the mech properties of the synthetic and the appearance of the natural yarn.",RETROZ RUBENS,,,https://lens.org/127-544-808-567-167,Patent Application,no,2,0,5,085-272-744-021-174;;181-139-077-386-141;;127-544-808-567-167;;072-827-792-790-327;;095-526-921-048-010,FR;;BR;;DE;;NL,5,085-272-744-021-174;;181-139-077-386-141;;127-544-808-567-167;;072-827-792-790-327;;095-526-921-048-010,FR;;BR;;DE;;NL,0,D02G3/04,D02G3/04,,0,0,,,,EXPIRED
236,CN,U,CN 213167214 U,126-625-781-816-853,2021-05-11,2021,CN 202021715822 U,2020-08-17,CN 202021715822 U,2020-08-17,Cotton textile fabric,"The utility model discloses a cotton textile fabric, which belongs to the technical field of fabrics and comprises a cotton base layer, the cotton base layer comprises cotton fiber yarns and viscose, and the cotton fiber yarns comprise first cotton synthetic yarns, second cotton synthetic yarns and antibacterial fiber yarns. The first synthetic cotton yarn and the second synthetic cotton yarn are spirally wound on the outer side of the antibacterial fiber yarn in the axial direction of the antibacterial fiber yarn, the antibacterial fiber yarn comprises first antibacterial yarn, second antibacterial yarn and deodorization yarn, and the first antibacterial yarn, the second antibacterial yarn and the deodorization yarn are spirally wound with one another. According to the cotton textile fabric, the antibacterial capacity of the cotton fabric can be improved, and the antibacterial durability is kept.",JINJIANG SHENGJI TEXTILE CO LTD,YANG ANFA,,https://lens.org/126-625-781-816-853,Limited Patent,no,0,0,1,126-625-781-816-853,CN,1,126-625-781-816-853,CN,0,,B32B9/02;;B32B9/00;;B32B9/04;;B32B23/02;;B32B23/10;;B32B27/02;;B32B27/12;;B32B27/36;;B32B27/40;;B32B33/00;;D02G3/04;;D02G3/38;;D02G3/44;;D03D13/00;;D03D15/217;;D03D15/233;;D03D15/283;;D03D15/47;;D03D15/50;;D03D15/573,,0,0,,,,ACTIVE
237,CN,U,CN 205728288 U,105-019-277-478-937,2016-11-30,2016,CN 201620080837 U,2016-01-27,CN 201620080837 U,2016-01-27,Ramie cotton shoe,"The utility model relates to a ramie cotton shoe. Including upper of a shoe and sole, the upper of a shoe includes surface course and inlayer, the inlayer includes at least one deck ramie linen layer, its surface course of upper of a shoe is pure cotton layer, ramie linen layer, cotton -flax blending cloth layer or cotton and chemical fibre blending cloth layer, its upper of a shoe mouth periphery of upper of a shoe is equipped with textile bale of cloth limit, the sole by the pure cotton layer in a plurality of layer and/or ramie linen layer through needle and line receive the system constitute, also or by the basic unit with locate bed course above the basic unit constitutes, the bed course includes at least one deck ramie linen layer, the table wall of sole is equipped with one deck bamboo charcoal fiber layer, the upper of a shoe through needle and line make up connect in the sole. This ramie cotton shoe is rational in infrastructure, and preparation simple process wears dry and comfortablely, comfortable, durable.",JIANGXI FULIAN IND CO LTD,WANG JINFENG,,https://lens.org/105-019-277-478-937,Limited Patent,no,0,0,1,105-019-277-478-937,CN,1,105-019-277-478-937,CN,0,,A43B1/02,,0,0,,,,INACTIVE
238,CN,A,CN 102758283 A,120-972-697-217-784,2012-10-31,2012,CN 201110106332 A,2011-04-27,CN 201110106332 A,2011-04-27,Bamboo charcoal-cashmere blended yarn,"The invention discloses a bamboo charcoal-cashmere blended yarn, comprising bamboo fibre yarns and cashmere yarns, wherein the bamboo fibre yarns and the cashmere yarns are spirally twisted, and the quantity ratio of the bamboo fibre yarns to the cashmere yarns in the bamboo charcoal-cashmere yarns is 7:3. According to the invention, the bamboo fibre yarns and the cashmere yarns are blended, thus making up the defects of the single function of the cashmere yarns, and the too high weight of the fabric prepared by the cashmere yarns; and the fabric prepared by the bamboo charcoal-cashmere blended yarns is light, thin and warm, and has the functions of absorbing moisture and releasing sweat, resisting bacteria and preventing mites, etc.",NANTONG LVBAJIAO TEXTILE PRODUCT CO LTD,ZHONG JIANG;;JUAN WANG;;XIAOYUN CHEN,,https://lens.org/120-972-697-217-784,Patent Application,no,0,1,1,120-972-697-217-784,CN,1,120-972-697-217-784,CN,0,,D02G3/04;;D02G3/36,,0,0,,,,DISCONTINUED
239,CN,A,CN 103614845 A,137-231-935-861-313,2014-03-05,2014,CN 201310678309 A,2013-12-14,CN 201310678309 A,2013-12-14,Tencel textile fabric,"The invention provides tencel textile fabric. Warp is made of jute, weft is made of tencel, wherein the diameter of the jute is 60.05 microns, the fineness of the jute is 539 tex, the diameter of the tencel is 41.34 microns, the fineness of the tencel is 388 tex, the density of the warp is 25.5 pieces per centimeter, and the density of the weft is 35.5 pieces per centimeter. The tencel textile fabric is simple in structure, good in usage performance and capable of meeting the special needs of customers.",XU YI,XU YI,,https://lens.org/137-231-935-861-313,Patent Application,no,0,3,1,137-231-935-861-313,CN,1,137-231-935-861-313,CN,0,,B32B7/12;;B32B9/02;;B32B23/02;;D03D13/00;;D03D15/217;;D03D15/225,,0,0,,,,DISCONTINUED
240,JP,A,JP H0782674 A,138-050-847-959-12X,1995-03-28,1995,JP 25246693 A,1993-09-13,JP 25246693 A,1993-09-13,PRINTING OF TEXTILE PRODUCT CONTAINING ACETATE AND CELLULOSE,"PURPOSE:To obtain a delicately dyed product usable as a fashionable apparel, etc., by printing a textile product composed of an acetate and a cellulose having quite different dyeabilities with a reactive dye. CONSTITUTION:A textile product containing an acetate and a cellulose is printed with a reactive dye. The dyeing process is carried out by preparatorily exposing the textile product to a treating liquid free from strongly alkaline substance, printing the treated textile product with a printing paste containing a strongly alkaline substance, applying a dyeing composition containing a weakly alkaline substance and a reactive dye to at least a part of the textile product before or after the printing process and heating the product with steam. The strongly alkaline substance is selected from sodium hydroxide, sodium carbonate, potassium hydroxide and potassium carbonate and the weakly alkaline substance is selected from sodium bicarbonate, sodium tripolyphosphate, sodium monochloroacetate, sodium dichloroacetate and sodium trichloroacetate.",DAIDO MARUTA FINISHING,GOTO YASUHIRO;;IHARADA MARUMI,,https://lens.org/138-050-847-959-12X,Patent Application,no,0,3,1,138-050-847-959-12X,JP,1,138-050-847-959-12X,JP,0,,D06P1/38;;D06P3/82;;D06P3/854,,0,0,,,,PENDING
241,GB,A,GB 402051 A,152-188-174-220-142,1933-11-23,1933,GB 512532 A,1932-02-20,GB 512532 A,1932-02-20,Method of and apparatus for the treatment of textile fibres,"<PICT:0402051/IV/1> <PICT:0402051/IV/2> <PICT:0402051/IV/3> Textile fibres, particularly artificial silk fibres, are subjected to after-treatment in stages at the same point in a plurality of separate compartments or cells which have independently controlled inlets and outlets for the liquid or gaseous media used, such as washing, bleaching and dyeing liquors, hot air, steam, ozone &c. Thus desulphurization of viscose silk may be effected in three stages, preliminary, main and after desulphurization. The several compartments may also be used for drying. The treating liquid or gas passes down through the cops 8 and out through perforations in the base. In the form shown on the right-hand side of Fig. 1, the cop-holder 9 can be rotated by a handle 31 to bring perforations 6<1> into or out of register with perforations 6 and so admit or cut off the entry of liquid to that chamber. In Fig. 3 the cops are arranged in a series of radial chambers 15 connectible to one another by valves 16 and each provided with individual valved inlets 17. In a further modification the liquid flows in a number of parallel streams through a corresponding number of rows of cops. Fig. 5 shows three drying chambers, 18, 19, 20 for wet fibres, each chamber containing a heating element 21 and air is passed from one chamber to the next. If desired the drying air may be mixed with ozone so that bleaching and drying take place simultaneously. Fresh drying air and ozone may be supplied from conduits 22, 23, 24, 25, and part of the air may be returned to the chamber 18 or 19. It is preferred to subject the artificial fibres to the action of ozone before desulphurization.",PARCOFIL AKTIEN GES,,,https://lens.org/152-188-174-220-142,Granted Patent,no,0,0,1,152-188-174-220-142,GB,1,152-188-174-220-142,GB,0,D01D10/0409,D01D10/04,B5B B312          16;;B5B B76Y          16,0,0,,,,EXPIRED
242,CN,U,CN 213322080 U,169-367-836-155-791,2021-06-01,2021,CN 202021498565 U,2020-07-27,CN 202021498565 U,2020-07-27,Textile fabric with good wear resistance,"The utility model discloses a textile fabric with good wear resistance. The textile fabric comprises a fabric body, a bamboo fiber layer, an anti-static layer, a polyester fiber layer, a polyamide fiber layer, a flax fiber layer, a wool fabric layer and bumps. The wear-resistant fabric is simple in structure, the wear resistance of the fabric is improved through the polyester, the chinlon and the anti-static fiber layer, the damage degree of wear is reduced in the long-time use process, the service life of the fabric is prolonged, the problem that the surface of the fabric is abraded too fast can be avoided as much as possible through the protruding blocks, and the use effect is improved; the linen fiber layer and the wool fabric layer are arranged so that the comfort of the fabric can be improved, moisture absorption and ventilation effects can be achieved in the using process of the fabric, the using comfort is improved, the anti-static performance can be improved through the anti-static layer, and the problem that static electricity is generated in the abrasion process is avoided.",WUJIANG JINDU WEAVING CO LTD,JIN XINHAI,,https://lens.org/169-367-836-155-791,Limited Patent,no,0,0,1,169-367-836-155-791,CN,1,169-367-836-155-791,CN,0,,B32B9/02;;B32B3/08;;B32B5/02;;B32B5/08;;B32B9/04;;B32B15/02;;B32B15/14;;B32B23/02;;B32B27/02;;B32B27/12;;B32B27/32;;B32B27/34;;B32B27/36,,0,0,,,,INACTIVE
243,CN,A,CN 115125751 A,185-036-088-276-70X,2022-09-30,2022,CN 202210615530 A,2022-06-01,CN 202210615530 A,2022-06-01,Method for cleanly and efficiently preparing cotton pulp from waste cotton textiles,"The invention belongs to the technical field of textile printing and dyeing processing, and particularly relates to a method for clean and efficient preparation of cotton pulp from waste cotton textiles, and the method specifically comprises the following steps: treating the waste cotton textiles, mixing the treated waste cotton textiles with alkali liquor, hydrogen peroxide, benzoquinone and sodium hexametaphosphate, adding the obtained mixture into a reaction kettle, and carrying out heat preservation at a certain temperature. And after the reaction is finished, washing with clear water, and grinding to obtain the cotton pulp fiber. According to the invention, an integrated cooking impurity removal technology for dye removal and metal ion removal is developed, the waste cotton textiles do not need to be crushed, the colors do not need to be sorted, the removal efficiency of various colors and impurity ions is very high, excessive degradation of cellulose in the cotton textiles by high temperature can be avoided, and the quality of the cotton textiles is improved. And recycling and development of waste cotton textile preparation are facilitated. The method is carried out under the mild temperature condition, the prepared cotton pulp has high whiteness and crystallinity, meanwhile, energy consumption can be effectively reduced, and the waste water treatment burden can be reduced.",UNIV QILU TECHNOLOGY,LIU KEYIN;;LUO JINLAN;;ZONG PEIPEI;;CHEN RUOYU;;KONG FANGONG;;ZHOU ZHE;;CAO ZHIPENG,,https://lens.org/185-036-088-276-70X,Patent Application,no,5,2,1,185-036-088-276-70X,CN,1,185-036-088-276-70X,CN,0,D21C3/02;;D06P5/132;;D21C3/222;;D21H11/12,D21C3/02;;D06P5/13;;D21C3/22;;D21H11/12,,2,0,,,"陈开勋主编: ""《新领域精细化工》"", vol. 1, 31 March 1999, 中国石化出版社, pages: 141;;陈嘉翔编著: ""《高效清洁制浆漂白新技术》"", vol. 1, 31 March 1996, 中国轻工业出版社, pages: 102",PENDING
244,WO,A1,WO 2009/045183 A1,184-529-101-191-049,2009-04-09,2009,TR 2008000014 W,2008-02-18,TR 200706808 A,2007-10-03,PROCESS FOR PRODUCTION OF ENVIRONMENT FRIENDLY FABRIC AND/OR TEXTILE PRODUCTS,"The invention relates to a process for production of environment-friendly fabric and textile products comprising the steps of obtaining fabric from organic cotton of 80-100% and colored cotton fiber of 20-0% without use of any chemical and/or synthetic agents and sizing /sizing removal process application, finishing of the fabrics by use of water vapor without use of any chemical and/or synthetic agents, production of textile products from the finished fabrics and washing and cleaning of the textile products with oxygen and environment-friendly ozone again without use of any chemical and/or synthetic agents.",GAP GUNEYDOGU TEKSTIL SANAYI V;;TASKOPARAN ERDINC,TASKOPARAN ERDINC,,https://lens.org/184-529-101-191-049,Patent Application,yes,4,16,2,184-529-101-191-049;;111-771-616-660-26X,TR;;WO,2,184-529-101-191-049;;111-771-616-660-26X,TR;;WO,0,D02G3/042;;D03D13/008;;D03D15/217;;D03D15/41;;D03D15/54;;D06L4/50;;D06P5/153;;D10B2201/02;;D10B2401/13;;D10B2501/00;;D03D15/41;;D03D15/217,D02G3/04;;A41D1/00;;D03D15/00;;D06F35/00;;D06M16/00,,2,0,,,"""Cotton: From Field to Fashion, Facts Behind the Fiber"", 2005, pages 1 - 7, XP002486955, Retrieved from the Internet <URL:http://www.lotusorganics.com/articles/cotton_facts.aspx> [retrieved on 20080704];;GABRIEL MONTE: ""Clothing Company Considers Environment"", 17 July 2003 (2003-07-17), pages 1, XP002486954, Retrieved from the Internet <URL:http://www.americanapparel.net/presscenter/articles/20030717ntdaily.html> [retrieved on 20080704]",PENDING
245,DE,D1,DE 3682341 D1,006-129-029-448-366,1991-12-12,1991,DE 3682341 T,1986-07-10,DE 3682341 T;;DE 3525254 A,1985-07-15,VERFAHREN ZUR HERSTELLUNG VON PLATTEN ODER FORMTEILEN.,"Reprocessing of lacquer waste involves converting the crosslinked waste into an aq. dispersion using surfactants (I) and mechanical force. Pref. the waste consists of lacquer residues, partly dried waste or slurries. It is mixed with (I) by stirring, adjusted to pH 7.0-10.0, pref. 8.0-8.5 (with aq. NH3, organic prim., sec. or tert. aliphatic amines (NEt3) and/or aminoalcohols (mono- or tri-ethanolamine or dimethylethanolamine) and treated with water to form a stable aq. emulsion up to a water content of 10-60, pref. 20-35 (wt.)%. (I) are anionic, cationic, nonionic or amphoteric surfactants and are used in an amt. of 1-10%. Suitable (I) include 2-5% ethoxylated nonylphenol or octylphenol with 4-40 ethoxy gps./mol.; 2-5% Ca and/or Mg ligninsulphonate; 2-5% long chain organic carboxylic acid (pref. oxidatively drying fatty acids, e.g. oleic, linseed oil, soy oil, tall oil or castor oil fatty acids or resin acids and/or polybutadiene reacted with di- or tricarboxylic acids), neutralised with NH3 or an amine (mono-or triethanolamine). During or after formation, the aq. dispersion may be treated with: a) a stabiliser (PVA, a water-soluble cellulose ester or ether, e.g. methylcellulose, NaCMC, HEC or cellulose acetate), casein, PVP and/or a xanthate in aq. soln. or in solid form); b) 0-250% filler, pref. 10-80, esp. 20-60% oscillation and/or sound damping filler (vermiculite, mica, expanded clay, rubber powder and/or finely-divided plastics foam with a particle size up to 2 mm); c) 2-70, pref. 30-50% natural and/or synthetic organic and/or inorg. fibres (fibre waste, rockwool, glass fibres, wood powder, chips and/or waste); d) 0.1-3, pref. 0.5-1.5% dispersion stabiliser (thermosetting resin, hardener, cure accelerator and/or catalyst, pref. a thermosetting melamine, urea, epoxide or carbamide resin with a organic acid, e.g. p-toluenesulphonic acid, naphthalenesulphonic acid, tartaric acid, citric acid and/or maleic acid, opt. neutralised with NH3 or an organic",ICI LACKE FARBEN,OPITZ HEINZ;;LANDTAU KARL-ERNST;;KUEHHIRT WALTER DR,,https://lens.org/006-129-029-448-366,Granted Patent,no,0,0,7,031-113-970-016-261;;157-260-519-116-638;;006-129-029-448-366;;143-360-334-127-066;;036-368-872-849-020;;037-513-560-700-977;;188-365-590-011-252,ES;;EP;;DE;;AT,7,031-113-970-016-261;;157-260-519-116-638;;006-129-029-448-366;;143-360-334-127-066;;036-368-872-849-020;;037-513-560-700-977;;188-365-590-011-252,ES;;EP;;DE;;AT,0,C08J11/00;;C08J3/03,C08J3/03;;C08J11/00;;C08J11/06;;C09D7/00,,0,0,,,,EXPIRED
