"#",Jurisdiction,Kind,Display Key,Lens ID,Publication Date,Publication Year,Application Number,Application Date,Priority Numbers,Earliest Priority Date,Title,Abstract,Applicants,Inventors,Owners,URL,Document Type,Has Full Text,Cites Patent Count,Cited by Patent Count,Simple Family Size,Simple Family Members,Simple Family Member Jurisdictions,Extended Family Size,Extended Family Members,Extended Family Member Jurisdictions,Sequence Count,CPC Classifications,IPCR Classifications,US Classifications,NPL Citation Count,NPL Resolved Citation Count,NPL Resolved Lens ID(s),NPL Resolved External ID(s),NPL Citations,Legal Status
1,CN,B,CN 101903580 B,006-871-513-754-919,2014-11-19,2014,CN 200880121452 A,2008-12-10,AT 2008000440 W;;AT 20892007 A,2007-12-20,"Yarns, high wear resistance fabrics and objects made therefrom",,CHEMIEFASER LENZING AG,CRNOJA-COSIC MARINA;;TAYLOR JAMES MARTIN,,https://lens.org/006-871-513-754-919,Granted Patent,no,0,0,19,106-608-923-356-996;;018-418-512-644-515;;157-755-822-790-97X;;185-055-559-031-906;;179-186-863-317-08X;;080-389-540-258-53X;;125-983-650-177-83X;;006-871-513-754-919;;120-971-463-522-861;;178-079-710-104-833;;142-379-807-857-928;;058-278-375-738-433;;043-183-430-428-627;;061-956-551-952-331;;131-160-795-115-621;;062-526-336-353-332;;024-508-689-923-428;;107-153-454-090-934;;189-610-408-247-326,CN;;ES;;BR;;TW;;EP;;KR;;WO;;US;;AT;;JP,19,106-608-923-356-996;;018-418-512-644-515;;157-755-822-790-97X;;185-055-559-031-906;;179-186-863-317-08X;;080-389-540-258-53X;;125-983-650-177-83X;;006-871-513-754-919;;120-971-463-522-861;;178-079-710-104-833;;142-379-807-857-928;;058-278-375-738-433;;043-183-430-428-627;;061-956-551-952-331;;131-160-795-115-621;;062-526-336-353-332;;024-508-689-923-428;;107-153-454-090-934;;189-610-408-247-326,CN;;ES;;BR;;TW;;EP;;KR;;WO;;US;;AT;;JP,0,D02G3/045;;D02G3/442;;D03D1/0041;;D03D15/225;;D03D15/283;;D03D15/47;;D03D15/573;;D10B2201/02;;D10B2201/20;;D10B2201/22;;D10B2201/24;;D10B2331/02;;D10B2401/063;;D10B2501/00;;D10B2505/08;;Y10T428/249921;;Y10T442/2631;;Y10T442/313;;Y10T442/3976;;Y10T442/438;;D02G3/045;;D01F2/00;;D01F8/12;;D02G3/442;;D02G3/446;;D03D1/00;;D03D13/00;;D03D15/225;;D03D15/283;;D03D15/47;;D04B1/14;;D10B2501/04;;D10B2503/00;;D10B2503/06;;D10B2503/062;;D10B2505/12;;D02G3/045;;D02G3/442;;D03D1/0041;;D03D15/225;;D03D15/283;;D03D15/47;;D03D15/573;;D10B2201/02;;D10B2201/20;;D10B2201/22;;D10B2201/24;;D10B2331/02;;D10B2401/063;;D10B2501/00;;D10B2505/08;;Y10T428/249921;;Y10T442/2631;;Y10T442/313;;Y10T442/3976;;Y10T442/438,D02G3/04;;D03D15/00;;D04B1/14,,0,0,,,,INACTIVE
2,KR,A,KR 20230105014 A,013-415-974-758-490,2023-07-11,2023,KR 20220000061 A,2022-01-03,KR 20220000061 A,2022-01-03,BIODEGRADABLE DISPOSABLE SCRUBBER AND METHOD FOR MAKING THE SCRUBBER,"The present invention relates to a biodegradable disposable scrubber and a method for manufacturing the same. More specifically, the present invention provides a biodegradable disposable scrubber and a method for manufacturing the same, wherein the biodegradable disposable scrubber uses Gelidium amansii and Pueraria montana var. lobate to have excellent biodegradability, does not cause environmental pollution problems caused by microplastics, and has excellent cleaning power and usability, so there is no problem with bacterial growth.",UNIV DONG EUI IND ACAD COOP FOUND,HA HYUN SU;;JANG SEOK HYUN;;MOON TAE HOON;;LEE JAE WOO;;KIM SOO JIN;;ROH HYUNG WON;;KANG KYOUNG KU,,https://lens.org/013-415-974-758-490,Patent Application,no,6,0,2,154-792-066-952-489;;013-415-974-758-490,KR,2,154-792-066-952-489;;013-415-974-758-490,KR,0,A47L17/08;;D01F2/00;;D10B2201/01;;D10B2401/12,A47L17/08;;D01F2/00,,0,0,,,,ACTIVE
3,RS,A2,RS 20100407 A2,015-620-233-691-87X,2012-06-30,2012,RS P20100407 A,2010-09-14,RS P20100407 A,2010-09-14,NATURAL SILK MADE FROM SUNFLOWER FIBRES,"Invention herewith described refers to the natural silk made from the sunflower fibres which are in the first phase obtained by soaking the sunflower stalks with a continuous effecting of the warm water of the temperature around 35°C on the woody part of the sunflower stalk, for a continuous period of 72 hours. During this period the pectic substances (vegetable glue) dissolve and the scutch (woody part of the plant) separates from the fibres. In the second stage, there is performed the extraction of so obtained fibres from the scutch and their use as textile fibres for making silk yarn.The textile fibres from the sunflower stalk are vegetable protein fibres that can be used as the raw material for making silk clothing fabric (for the summer and work clothes), for producing silk fabrics for households, and decorative fabrics (luxurious materials of a wide range of colours, patterns and weaving) for furniture upholstery, draperies, curtains, coverlets and carpets. These fibres can also be used for the production of technical textiles and composite materials (building materials, pressed panels, insulating panels), thus meeting the actual environmental requirements.These fibres are used for making the special pulp used in paper making, and in medicine for making surgical thread.",DURASINOVIC JOVAN,DURASINOVIC JOVAN,,https://lens.org/015-620-233-691-87X,Unknown,no,0,0,2,044-744-622-304-77X;;015-620-233-691-87X,RS,2,044-744-622-304-77X;;015-620-233-691-87X,RS,0,,D01B1/10;;A61K36/28,,0,0,,,,PENDING
4,US,A,US 2132492 A,011-289-808-425-861,1938-10-11,1938,US 73171934 A,1934-06-21,US 73171934 A,1934-06-21,Rayon structure,,DU PONT,PARKER HAROLD H,,https://lens.org/011-289-808-425-861,Granted Patent,no,0,7,1,011-289-808-425-861,US,1,011-289-808-425-861,US,0,B60C9/0042;;D02G3/48;;D10B2201/22;;B60C9/0042;;D02G3/48;;D10B2201/22,B60C9/00,,0,0,,,,EXPIRED
5,KR,B1,KR 100698515 B1,016-916-010-019-268,2007-03-21,2007,KR 20060063049 A,2006-07-05,KR 20060063049 A,2006-07-05,METHOD FOR PRODUCING BAMBOO BOARD,"A bamboo board manufacturing method is provided to be used as materials for vehicles or ships and to absorb shock applied to freight by using barks of the coconut palms. The bamboo board manufacturing method comprises the steps of: laminating thin and long bamboo skin textiles in horizontal and vertical directions with crossing each other; inserting a wood material to form a hollow part between the bamboo textiles; dipping the bamboo textiles in an adhesive agent; and pressing the bamboo textiles at high pressure by a press(30). The adhesive agent is heated at 100~120C. After the pressing step, the bamboo textiles are polished by fine sand and varnished. The strength of the outer side of a bamboo board is high by making the outer side of the bamboo textiles. The inner side is made of light wood.",,,,https://lens.org/016-916-010-019-268,Granted Patent,no,2,3,1,016-916-010-019-268,KR,1,016-916-010-019-268,KR,0,B27J1/003;;B27D3/00;;B32B7/12;;B32B21/042,B27J1/00,,0,0,,,,INACTIVE
6,CN,U,CN 215792248 U,023-908-832-136-432,2022-02-11,2022,CN 202122123731 U,2021-09-04,CN 202122123731 U,2021-09-04,Shrink-proof anti-wrinkle all-cotton textile fabric,"The utility model relates to the technical field of fabrics, and discloses a shrink-proof anti-wrinkle all-cotton textile fabric which comprises an all-cotton textile layer, an elastic textile layer is fixedly connected to the side wall of the upper side of the all-cotton textile layer, and an anti-wrinkle layer is fixedly connected to the side wall of the side, away from the all-cotton textile layer, of the elastic textile layer. A heat preservation layer is fixedly connected to the side wall of the lower side of the all-cotton textile layer, and a sweat absorption layer is fixedly connected to the side wall of the side, away from the all-cotton textile layer, of the heat preservation layer. The shrink-proof and crease-resistant performance of the fabric can be improved, and the use comfort of the fabric is effectively improved.",DONGGUAN KISENSE KNITTING CO LTD,ZHANG YANLONG,,https://lens.org/023-908-832-136-432,Limited Patent,no,0,0,1,023-908-832-136-432,CN,1,023-908-832-136-432,CN,0,,B32B9/02;;B32B9/04;;B32B27/32;;B32B33/00,,0,0,,,,ACTIVE
7,CN,A,CN 109295602 A,023-226-348-485-413,2019-02-01,2019,CN 201811012122 A,2018-08-31,CN 201811012122 A,2018-08-31,Bamboo filament underwear knitted fabric,"The invention discloses bamboo filament underwear knitted fabric. Knitting is performed by using long mulberry silk as surface yarn, spandex filaments as base yarn and bamboo filament and semi-dull filaments as a middle layer, wherein a mass ratio of the long mulberry silk, bamboo filament, semi-dull filaments and spandex filaments is 6:2:1:1. The purpose of the invention is to provide the bamboofilament underwear knitted fabric which integrates functionality, ultra-lightness, ultra-thinness, softness and smoothness.",TIANMEN HAOMAI JINDU GARMENT CO LTD,XIA LIMING,,https://lens.org/023-226-348-485-413,Patent Application,no,0,0,1,023-226-348-485-413,CN,1,023-226-348-485-413,CN,0,D04B1/14;;A41B17/00;;D04B1/16;;D04B1/18;;D10B2201/10;;D10B2211/04;;D10B2331/10,D04B1/14;;A41B17/00;;D04B1/16;;D04B1/18,,0,0,,,,DISCONTINUED
8,AU,A1,AU 2015/308591 A1,037-200-533-346-768,2017-02-02,2017,AU 2015/308591 A,2015-08-31,US 201562154248 P;;US 201462043737 P;;US 2015/0047762 W,2014-08-29,Flame resistant fabrics having cellulosic filament yarns,"Flame resistant fabrics that have incorporated into them cellulosic filament yarns. The cellulosic filament yarns may be flame resistant (either inherently FR or treated so as to be FR) or non-flame resistant. Fabrics according to some embodiments are formed entirely of cellulosic filament yarns. However, fabrics according to some embodiments include additional yarns to ensure that the fabric complies with NFPA 1971 and/or 2112.",SOUTHERN MILLS INC,HABICHT CHRISTINE J;;DUNN CHARLES S;;STANHOPE MICHAEL T;;COLATRUGLIO MATTHEW LUCIUS,,https://lens.org/037-200-533-346-768,Patent Application,no,0,0,12,035-854-975-631-697;;172-517-464-339-184;;156-501-156-122-542;;188-437-171-448-02X;;164-843-403-269-50X;;037-200-533-346-768;;076-810-572-858-216;;122-672-678-906-750;;034-828-320-827-861;;176-496-811-968-459;;175-747-677-253-74X;;173-006-532-295-307,CN;;BR;;CA;;EP;;AU;;WO;;US;;JP,12,037-200-533-346-768;;172-517-464-339-184;;156-501-156-122-542;;188-437-171-448-02X;;164-843-403-269-50X;;035-854-975-631-697;;076-810-572-858-216;;122-672-678-906-750;;034-828-320-827-861;;176-496-811-968-459;;175-747-677-253-74X;;173-006-532-295-307,CN;;BR;;CA;;EP;;AU;;WO;;US;;JP,0,D02G3/443;;A41D31/08;;D02G3/02;;D03D1/0035;;D03D15/513;;D04B1/16;;D10B2201/20;;D10B2321/101;;D10B2331/021;;D02G3/443;;A41D31/08;;D02G3/02;;D03D1/0035;;D03D15/513;;D04B1/16;;D10B2201/20;;D10B2321/101;;D10B2331/021,D03D15/12;;D02G3/04;;D04B1/16,,0,0,,,,ACTIVE
9,PL,T3,PL 2175764 T3,026-787-858-248-521,2013-10-31,2013,PL 08767249 T,2008-06-26,SE 0701575 A;;EP 08767249 A;;SE 2008050783 W,2007-06-29,CLEANING CLOTH,,DUROTURF INT AB,LINDBLAD JAN,,https://lens.org/026-787-858-248-521,Patent Application,no,0,0,15,159-763-916-502-150;;041-538-049-753-911;;116-768-551-607-250;;058-490-398-059-087;;045-901-957-181-997;;060-947-782-544-414;;115-311-717-844-584;;121-416-208-956-498;;048-609-306-243-331;;158-979-523-935-250;;004-257-841-290-92X;;082-823-562-961-359;;034-124-107-957-469;;026-787-858-248-521;;095-720-854-516-177,HR;;CN;;ES;;PT;;DK;;EP;;SI;;CY;;PL;;US;;WO,15,159-763-916-502-150;;045-901-957-181-997;;116-768-551-607-250;;058-490-398-059-087;;041-538-049-753-911;;060-947-782-544-414;;115-311-717-844-584;;048-609-306-243-331;;121-416-208-956-498;;158-979-523-935-250;;004-257-841-290-92X;;082-823-562-961-359;;034-124-107-957-469;;026-787-858-248-521;;095-720-854-516-177,HR;;CN;;ES;;PT;;DK;;EP;;SI;;CY;;PL;;US;;WO,0,A47L13/256;;A47L13/16;;A47L13/44;;D03D1/0023;;D03D15/283;;D03D15/587;;D06M10/00;;D06M17/06;;D10B2201/01;;D10B2201/02;;D10B2201/24;;D10B2201/28;;D10B2211/02;;D10B2211/04;;D10B2321/021;;D10B2321/022;;D10B2321/041;;D10B2331/02;;D10B2331/04;;D10B2401/041;;D10B2401/062;;A47L13/256;;A47L13/16;;A47L13/44;;D03D1/0023;;D03D15/283;;D03D15/587;;D06M10/00;;D06M17/06;;D10B2201/01;;D10B2201/02;;D10B2201/24;;D10B2201/28;;D10B2211/02;;D10B2211/04;;D10B2321/021;;D10B2321/022;;D10B2321/041;;D10B2331/02;;D10B2331/04;;D10B2401/041;;D10B2401/062,A47L13/16;;D03D27/00,,0,0,,,,PENDING
10,CN,A,CN 107696638 A,030-361-226-191-56X,2018-02-16,2018,CN 201610642150 A,2016-08-09,CN 201610642150 A,2016-08-09,Anti-mosquito fabric capable of permanently releasing large number of anions,"The invention relates to an anti-mosquito fabric capable of permanently releasing a large number of anions. The anti-mosquito fabric comprises a base layer (1), wherein a supporting layer (2), a breathable layer (3) and an anti-mosquito layer (4) are successively arranged outside of the base layer; the back surface of the base layer is provided with a lining fabric layer, and the lining fabric isan anion fabric and comprises ordinary yarns, elastic yarns and anion yarns which are interwoven through a double-side weaving method; the ordinary yarns are woven on the outer surface of the lining fabric layer and have a component content larger than 50%; the elastic yarns have a component content of 2% and replace a part of the ordinary yarns in weaving arrangement; and the anion yarns are woven on the inner surface of the lining fabric layer and have a component content less than 48%. The anti-mosquito fabric provided by the invention is insusceptible to deformation, has good air-permeableeffect, can inhibit and kill bacteria, and can permanently release a large number of anions.",JIANGYIN HUADONG DECORATIVE MAT CO LTD,ZHU GUANGHE,,https://lens.org/030-361-226-191-56X,Patent Application,no,0,0,1,030-361-226-191-56X,CN,1,030-361-226-191-56X,CN,0,B32B5/02;;B32B5/06;;B32B5/26;;B32B33/00;;B32B2250/20;;B32B2262/00;;B32B2262/02;;B32B2262/0253;;B32B2262/0292;;B32B2262/062;;B32B2262/065;;B32B2262/103;;B32B2305/18;;B32B2307/70;;B32B2307/7145;;B32B2307/724;;B32B2307/764;;B32B2437/00;;D03D15/00;;D03D15/56;;D10B2201/02;;D10B2201/10;;D10B2211/20;;D10B2321/10;;D10B2331/10,B32B9/02;;B32B5/02;;B32B5/06;;B32B5/26;;B32B9/00;;B32B9/04;;B32B15/02;;B32B15/098;;B32B15/14;;B32B27/02;;B32B27/32;;B32B27/40;;B32B27/42;;B32B33/00;;D03D15/20;;D03D15/208;;D03D15/217;;D03D15/233;;D03D15/283;;D03D15/50;;D03D15/56,,0,0,,,,DISCONTINUED
11,CN,U,CN 211000250 U,040-071-409-533-216,2020-07-14,2020,CN 201921837082 U,2019-10-29,CN 201921837082 U,2019-10-29,Wear-resistant bamboo fiber textile fabric,"The utility model discloses a wear-resistant bamboo fiber textile fabric. The fabric structurally comprises a fabric body, an upper wear-resistant layer, a lower wear-resistant layer, a fixing mechanism and a bamboo fiber layer, the fixing mechanism is composed of a rotating block, antiskid lines, a rotating column, protruding strips, a threaded rod, a lower suction cup, a shell, a threaded sleeveand an upper suction cup. According to the wear-resistant bamboo fiber textile fabric, the fixing mechanism is arranged; cloth is fixed at the lower end of the rotating column; then the rotating block is covered and rotated; the problems that when the bamboo fiber textile cloth needs to be cut or spread, the corners of the cloth are prone to sliding, the cloth is inconvenient to fix, deviation occurs during cutting, and the cut edge is uneven are solved, and the effect of facilitating fixing is achieved.",KUNSHAN SHENGXU TEXTILE CO LTD,XU YAN,,https://lens.org/040-071-409-533-216,Limited Patent,no,0,0,1,040-071-409-533-216,CN,1,040-071-409-533-216,CN,0,,B32B3/12;;B32B3/08;;B32B9/02;;B32B9/04,,0,0,,,,INACTIVE
12,EP,A1,EP 0752458 A1,079-455-339-538-481,1997-01-08,1997,EP 96110047 A,1996-06-21,DE 19524373 A,1995-07-04,Process for flame-proofing treatment of textile sheet materials and products treated by such process,"The process is for fireproofing textile sheet materials consisting mainly of combustible fibres, in which expanded graphite in the form of discrete adherent flakes (I) is applied to at least one surface of the textile or to one of the fibre layers forming the sheet. Also claimed is textile fabric treated by this process, based on wool, cotton, flax, sisal, coconut and/or cellulose fibres or combustible synthetic fibres.",SCHILL & SEILACHER,FRITZ BRUNO;;WOLBER DIETER DR;;MUENKEL JOSEF,SCHILL + SEILACHER AKTIENGESELLSCHAFT (2003-03-26),https://lens.org/079-455-339-538-481,Patent Application,yes,6,22,4,069-226-949-013-904;;079-455-339-538-481;;080-630-432-278-46X;;048-038-715-829-791,DE;;EP,4,069-226-949-013-904;;079-455-339-538-481;;080-630-432-278-46X;;048-038-715-829-791,DE;;EP,0,C09K21/02;;D06M11/74;;D06M15/05;;D06M15/11;;D06M15/333;;D06N3/0063,C09K21/02;;D06M11/74;;D06M15/05;;D06M15/11;;D06M15/333;;D06N3/00,,0,0,,,,EXPIRED
13,CN,U,CN 209141589 U,052-537-615-048-542,2019-07-23,2019,CN 201821774331 U,2018-10-23,CN 201821774331 U,2018-10-23,Textile fabric with good breathable effect,"The utility model provides a textile fabric with a good breathable effect, and relates to the field of fabrics. The textile fabric with the good breathable effect comprises a flax layer, the bottom ofthe flax layer is bonded with the top of a sweat absorbing layer, an elastic breathable layer is bonded with the bottom of the sweat absorbing layer, an anti-static layer is bonded with the bottom ofthe elastic breathable layer, and a nylon layer is woven at the bottom of the anti-static layer. The utility model discloses a textile fabric with a good breathable effect. An elastic breathable layer is arranged between the sweat absorbing layer and the anti-static layer; when a user does exercises, the elastic breathable layer correspondingly fluctuates due to the change of the exercises, so that the air holes of the elastic terylene, the elastic gauze element and the elastic jean on the elastic breathable layer are enlarged, the breathability is realized, the breathability effect can be correspondingly changed according to the change of the exercises, the breathability effect is good, the comfort level is high, and the reliability is high.",HANGZHOU YIBEI FURNITURE MFG CO LTD,GAO JISHENG,,https://lens.org/052-537-615-048-542,Limited Patent,no,0,0,1,052-537-615-048-542,CN,1,052-537-615-048-542,CN,0,,B32B9/02;;B32B3/08;;B32B9/04;;B32B27/06;;B32B27/12;;B32B27/34,,0,0,,,,ACTIVE
14,CN,A,CN 104191709 A,071-317-891-936-356,2014-12-10,2014,CN 201410427360 A,2014-08-28,CN 201410427360 A,2014-08-28,Health-care bamboo fiber textile fabric,"The invention relates to a health-care bamboo fiber textile fabric comprising a base cloth layer (1) and a fabric layer (2), wherein a far infrared functional interlayer (3) is arranged between the base cloth layer (1) and the fabric layer (2) and is made of far infrared fibers; and the base cloth layer comprises base cloth formed by interweaving warp yarns and weft yarns, wherein both the warp yarns and weft yarns are formed by blending bamboo fibers and organic cotton fibers, an activated carbon powder or bamboo charcoal powder coating is coated on one surface of the base cloth, and a far infrared coating is coated on the other surface of the base cloth. The health-care bamboo fiber textile fabric can take a health-care effect and has favorable heat preservation and antibacterial properties. The bamboo fiber textile fabric disclosed by the invention can take effects of bacterium resistance, bacteriostasis, mold prevention and healthcare, can also take effects of promoting blood circulation of a human body and regulating metabolism, and cannot generate the phenomenon of skin allergy.",JIANGSU BAILIDA CO LTD,NI LIFENG;;WANG JINQI;;LIU GUO,,https://lens.org/071-317-891-936-356,Patent Application,no,0,3,1,071-317-891-936-356,CN,1,071-317-891-936-356,CN,0,,B32B9/02;;B32B9/04;;B32B33/00,,0,0,,,,DISCONTINUED
15,CN,U,CN 205041794 U,066-537-410-049-259,2016-02-24,2016,CN 201520710629 U,2015-09-14,CN 201520710629 U,2015-09-14,Chitin fibre silk fibre blending facial mask,"The utility model relates to a chitin fibre silk fibre blending facial mask, including chitin fibre silk fibre blending layer, chitin fibre silk fibre blending layer is interweaved mutually by warp group and woof group and forms, warp group and weft threads component do not include NULL's chitin fibre and silk fibre. This chitin fibre silk fibre blending facial mask carries out specific structures's range with chitin fibre and silk fibre to it forms chitin fibre silk fibre blending layer to interweave, and be splendid with the laminating nature of skin by the facial mask that this blending layer is formed, need not to carry out extra notched setting, and the nutrient solution adsorbs totally, the phenomenon of the lower seepage of nutrient solution when having avoided using, great improvement in the past traditional facial mask give people the inconvenience that the cosmetology brought.",INST INDUSTRY TECHNOLOGY GUANGZHOU & CAS,YANG FAN;;CHEN JIANLIANG;;HA CHENGYONG;;CHEN GUOLIANG,,https://lens.org/066-537-410-049-259,Limited Patent,no,0,5,1,066-537-410-049-259,CN,1,066-537-410-049-259,CN,0,,A61K8/02;;A61Q19/00;;B32B5/14;;D03D15/00,,0,0,,,,INACTIVE
16,US,A,US 3932125 A,068-755-367-742-573,1976-01-13,1976,US 43626474 A,1974-01-24,US 43626474 A;;US 50464374 A,1974-01-24,Preparation of stretchable wool textiles,"Wool textiles of enhanced stretch properties are prepared by contacting the textile with a hydroxylic liquid, i.e., ethylene glycol, propylene glycol, glycidol, glycerol, or diethylene glycol, under controlled conditions of time and temperature.",US AGRICULTURE,WASLEY WILLIAM L;;PITTMAN ALLEN G,,https://lens.org/068-755-367-742-573,Granted Patent,yes,5,4,4,087-046-560-286-298;;053-128-303-216-112;;068-755-367-742-573;;165-248-566-143-522,GB;;US;;JP,4,087-046-560-286-298;;053-128-303-216-112;;068-755-367-742-573;;165-248-566-143-522,GB;;US;;JP,0,D06M13/148;;Y10T442/2377;;Y10T442/2762;;D06M13/148;;Y10T442/2377;;Y10T442/2762,D06M15/53;;D06M13/02;;D06M13/11;;D06M13/144;;D06M13/148;;D06M13/248;;D06M13/256;;D06M101/00;;D06M101/02;;D06M101/10;;D06M101/12,8128R,1,0,,,"Chem. Abst., p. 5866, 1955.",EXPIRED
17,CN,A,CN 102849312 A,087-875-708-278-082,2013-01-02,2013,CN 201210296346 A,2012-08-21,CN 201210296346 A,2012-08-21,Textile bag,"The invention discloses a textile bag, comprising a bag body, wherein the bag body is formed by mixing and braiding cotton and jute; one protective layer is arranged at the inner side of the bag body; the protective layer and the bag body adopt a detachable structure; a lifting handle is arranged at the top of the bag body; the lifting handle is provided with a clamping buckle and side edge openings are respectively arranged at the two sides of the lifting handle; and the whole shape of the bag body is the shape of a coat. The textile bag disclosed by the invention is simple in process and is ingenious in design; the textile bag can be effectively used in our life, such as shopping in a supermarket; the textile bag can be better lifted and used; the textile bag is low in manufacturing cost and is more ventilated; the appearance is more animated and wholly looks like the shape of one coat; and the textile bag has the advantages of simple structure, wide application range, production cost saving and novel design, is a novel design scheme and is good for being popularized and used.",WANG HONGLIANG,WANG HONGLIANG,,https://lens.org/087-875-708-278-082,Patent Application,no,0,0,1,087-875-708-278-082,CN,1,087-875-708-278-082,CN,0,,B65D30/10;;B65D30/04;;B65D30/08;;B65D33/12;;B65D33/25,,0,0,,,,DISCONTINUED
18,CN,A,CN 105603611 A,092-829-375-033-995,2016-05-25,2016,CN 201510960672 A,2015-12-21,CN 201510960672 A,2015-12-21,Smooth rabbit wool textile,"The invention discloses a smooth rabbit wool textile. According to the smooth rabbit wool textile, warp and weft are woven into a fabric body, wherein the warp is formed by blending nanometer carbon dioxide with viscose, and the weft is formed by blending rabbit wool fiber with natural colorful cotton. The smooth rabbit wool textile has the advantages of being low in cost and good in warmth keeping performance and flexibility.",CHANGSHU RONGCHENG TEXTILE CO LTD,XU BAOYU,,https://lens.org/092-829-375-033-995,Patent Application,no,0,0,1,092-829-375-033-995,CN,1,092-829-375-033-995,CN,0,D03D15/47;;D02G3/04;;D02G3/042;;D10B2101/02;;D10B2201/02;;D10B2201/24;;D10B2211/01,D02G3/04;;D03D15/217;;D03D15/225;;D03D15/233;;D03D15/47;;D03D15/50,,0,0,,,,DISCONTINUED
