82,CN,U,CN 201952576 U,017-722-842-022-022,2011-08-31,2011,CN 201020668397 U,2010-12-20,CN 201020668397 U,2010-12-20,Spun silk fiber blending cotton fabric for home textiles,"The utility model provides a spun silk fiber blending cotton fabric for home textiles, the warn density of the blending cotton fabric is 351.5 threads/10cm, the weft density is 353 threads/10cm, the fabric width is 160cm; the structure of the blending cotton fabric is 1/1 plain weave, The beneficial effects of the spun silk fiber blending cotton fabric in the utility model are in that: the blending cotton fabric is provided with good characteristics of spun silk fiber, and is advantaged by fine cloth cover, soft and smooth hand feeling, bright gloss, no easy wrinkling, first selected product of home textile fabrics, as well as health functions such as ultraviolet resistance, enhancement of cell activity, prevention of blood vessel hardening, etc., the spun silk fiber blending cotton fabric provides reference for promotion of development of blending cotton fabrics, and creates good economic benefit for home textile industry.",JIANGSU GOLDSUN TEXTILE SCIENCE & TECHNOLOGY CO LTD,HONGBING YUAN,,https://lens.org/017-722-842-022-022,Limited Patent,no,0,0,1,017-722-842-022-022,CN,1,017-722-842-022-022,CN,0,,D03D13/00;;D03D15/217;;D03D15/233;;D03D15/47,,0,0,,,,EXPIRED
83,CN,A,CN 104116241 A,052-331-545-599-512,2014-10-29,2014,CN 201410331382 A,2014-07-14,CN 201410331382 A,2014-07-14,Bamboo fiber textile fabric clothes capable of preserving heat of food,"The invention relates to bamboo fiber textile fabric clothes capable of preserving heat of food. The bamboo fiber textile fabric clothes comprise a clothes body (1). A pocket of the clothes body (1) is provided with a large warm-keeping interlayer (2) made of foam. The clothes body (1) is made of a fabric; the fabric comprises base cloth formed by interweaving warp yarns and weft yarns, and both the warp yarns and the weft yarns are formed by blending bamboo fibers and organic cotton fibers; one surface of the base cloth is coated with an activated carbon powder coating or a bamboo carbon powder coating, and the other surface of the base cloth is coated with a far-infrared coating. The food is put into the pocket after being packaged, the foam in the warm-keeping interlayer can prevent the food from making direct contact with the external air and effectively prevent the heat of the food from diffusing, and therefore the effect of preserving the heat of the food is achieved. The bamboo fiber textile fabric clothes can resist and restrain bacteria, prevent mildew, achieve the health-caring effect, promote blood circulation of the human body and regulate metabolism and will not cause skin allergy.",JIANGYIN HAIYING WOOLEN GOODS CO LTD,ZHOU ZHONGPING,,https://lens.org/052-331-545-599-512,Patent Application,no,0,0,1,052-331-545-599-512,CN,1,052-331-545-599-512,CN,0,,A41D27/00;;B32B5/18;;B32B5/24;;B32B33/00,,0,0,,,,DISCONTINUED
84,CN,A,CN 117210950 A,069-888-422-714-045,2023-12-12,2023,CN 202311273472 A,2023-09-28,CN 202311273472 A,2023-09-28,Preparation method of kapok viscose fiber,"The invention discloses a preparation method of kapok viscose fibers, and relates to the technical field of textile fibers. The ceiba viscose fiber is prepared by taking ceiba shells and/or seeds as raw materials through the processes of pretreatment, water washing, cooking, pulping, bleaching, dissolving, filtering, defoaming, spinning and post-treatment. The prepared kapok viscose fibers have antibacterial and anti-mite effects, the selection diversity of the viscose fibers is increased, the shortage of viscose fiber resources is relieved, the purpose of turning the kapok into wealth is achieved, the utilization value of the kapok is improved, the resources are saved, the application range of the kapok in fabric production is expanded, and the kapok viscose fibers are simple to operate and low in cost. The large-scale and industrial production can be realized.",SUPIELD TECH SHANGHAI CO LTD,YAN JIE;;LU HAIMING;;ZHANG XUE,,https://lens.org/069-888-422-714-045,Patent Application,no,0,0,1,069-888-422-714-045,CN,1,069-888-422-714-045,CN,0,Y02P70/62,D01F2/08;;D01C1/00;;D01D5/06,,0,0,,,,PENDING
85,CN,A,CN 109837775 A,068-965-899-292-281,2019-06-04,2019,CN 201711205801 A,2017-11-27,CN 201711205801 A,2017-11-27,Non-static acetate fiber textile line with uniform dyeing and avoidance of color loss,"The invention discloses a non-static acetate fiber textile line with uniform dyeing and avoidance of color loss. White slices are dried, and color masterbatches are dried. The dried white slices and the color masterbatches are mixed, and a mixture is melted. The melted mixture is spun to form a textile fabric, the textile fabric is soaked in a dye vat, and is insulated to finish ionic modificationof the textile fabric, and the obtained textile fabric is placed in the dye vat and is heated to be dyed. After an oil agent is added to the textile fabric, the textile fabric is subjected to paddingtreatment in an impregnating solution containing a finishing agent, and then is subjected to drying and baking treatment. The textile line made of acetate fibers can be in various colors, the colorsof the textile line are uniform and meet requirements, the preparation and processing method of the textile line is simple, the pollution is small, and the coloring efficiency is good. The textile fabric subjected to aftertreatment has the characteristics of microcirculation health care, warmth retention, anion carrying, no static electricity, uniform dyeing and no color loss.",JIA LONGPING,JIA LONGPING,,https://lens.org/068-965-899-292-281,Patent Application,no,0,0,1,068-965-899-292-281,CN,1,068-965-899-292-281,CN,0,,D06P3/60;;D06M11/56;;D06M11/57;;D06M11/71;;D06M13/127;;D06M13/21;;D06M13/292;;D06M13/438;;D06M13/513;;D06M15/09;;D06M101/06;;D06P1/34;;D06P1/645,,0,0,,,,DISCONTINUED
86,CN,A,CN 1450216 A,083-871-233-533-874,2003-10-22,2003,CN 02108628 A,2002-04-05,CN 02108628 A,2002-04-05,Worsted high count yarn technological method for blended spinning cashmere fibre and natural silk fibre,"The present invention relates to a technological process for spinning high-count yarn by using blended yarn of cashmere fibre and natural silk. It spinning count is 100/2-200/2, the cashmere content in the blended yarn is 10-90%, and the silk content is 90-100%. Said invention adopts the cashmere-mixing process and combing and spinning procedures, according to the difference of spinning ratio, its back cashmere moisture regain is 18-28%, oil content is 2-3%, curing is 8-24 hr, and the combined sliver fibre length is 35-50MM. Said invented high-count yarn can be used for producing knitted underwear, shirting textures, also can be used for producing worksted wraps and printed products, etc.",INNER MONGOLIA LUWANG CASHMERE,GAO FENG;;CHEN XIUYING;;SUN SHAOYUN,,https://lens.org/083-871-233-533-874,Patent Application,no,0,17,1,083-871-233-533-874,CN,1,083-871-233-533-874,CN,0,,D02G3/04,,0,0,,,,DISCONTINUED
87,CN,A,CN 103835041 A,100-302-444-047-467,2014-06-04,2014,CN 201310517402 A,2013-10-28,CN 201310517402 A,2013-10-28,Kenaf aramid fiber synthetic fiber/ aramid fiber filament composite yarn based on sirofil and processing method thereof,"The invention discloses a kenaf aramid fiber synthetic fiber/ aramid fiber filament composite yarn based on sirofil and a processing method thereof. The composite yarn is formed by twisting and combining two aramid fiber filaments and a kenaf aramid fiber synthetic fiber roving drafted thin strip. The two aramid fiber filaments and the kenaf aramid fiber synthetic fiber roving drafted thin strip are spirally, orderly and alternately distributed on the surface of the composite yarn. The kenaf aramid fiber synthetic fiber roving thin strip drafted by a spinning frame and two aramid fiber filaments fed in the rear end of a front roller of the spinning frame are mixed at the front end of the front roller and twisted to form the composite yarn. The two aramid fiber filaments are located on the two sides of the kenaf aramid fiber synthetic fiber thin strip respectively at the rear end of the front roller, and the distance between the two aramid fiber filaments ranges from 6 mm to 12 mm. The kenaf aramid fiber synthetic fiber/ aramid fiber filament composite yarn based on sirofil effectively solves the problem of yarn hairiness caused by rough kenaf fibers and the problem of low yarn strength caused by blending of kenaf and aramid fiber short fibers, has the advantages of being high in strength, less in hairiness and low in cost, and can be widely applied to protective textiles.",UNIV TIANJIN POLYTECHNIC,WANG CHUNHONG;;HE SHUNHUI,,https://lens.org/100-302-444-047-467,Patent Application,no,7,1,2,179-667-198-785-023;;100-302-444-047-467,CN,2,179-667-198-785-023;;100-302-444-047-467,CN,0,,D02G3/04;;D02G3/38,,0,0,,,,ACTIVE
88,CN,A,CN 117005121 A,113-272-147-513-65X,2023-11-07,2023,CN 202311032610 A,2023-08-16,CN 202311032610 A,2023-08-16,Processing method of acarus-killing antibacterial textile fabric,"The invention discloses a processing method of an acarus-killing antibacterial textile fabric, and relates to the field of textile fabrics. The processing method of the acarus-killing and antibacterial textile fabric comprises the following steps: firstly, selecting a proper textile fabric as a base material, commonly selecting natural fibers or synthetic fibers including cotton, silk and hemp, washing, bleaching and dyeing to ensure that the fabric is clean and the color is stable, uniformly distributing an antibacterial agent on the textile fabric in dipping, spraying and coating modes, and drying the textile fabric to obtain the acarus-killing and antibacterial textile fabric. In order to remove mites and other microorganisms in the textile fabric, high-temperature drying, ultraviolet irradiation and freezing methods are adopted for carrying out mite removal treatment, and an antibacterial agent and a mite removal agent are fixed on the textile fabric. According to the processing method of the acarus-killing antibacterial textile fabric, the cleaning effect of the fabric is guaranteed, meanwhile, the drying efficiency of the fabric can be improved, the drying time is shortened, and the processing quality of the fabric is improved.",MANXI HOLDING GUANGZHOU CO LTD,XING ZHICUN,,https://lens.org/113-272-147-513-65X,Patent Application,no,0,2,1,113-272-147-513-65X,CN,1,113-272-147-513-65X,CN,0,D06B1/02;;D06B15/02;;D06B15/085;;D06G1/00;;F26B13/10;;F26B13/28;;F26B21/001;;F26B21/004;;F26B5/14,D06B1/02;;B08B1/20;;D06B15/02;;D06B15/08;;D06G1/00;;F26B5/14;;F26B13/10;;F26B13/28;;F26B21/00,,0,0,,,,PENDING
89,US,A1,US 2004/0103481 A1,139-808-552-554-611,2004-06-03,2004,US 43310904 A,2004-01-20,GB 0029932 A;;GB 0105368 W,2000-12-06,Fibrillation of natural fibres,"Fibrillation of certain cellulosic fibres has been widely studied, and fibrillation can be utilised to improve fabric performance, for example strength, absorbency, surface area together with handle and opacity. However, it believed that keratinous fibres such as wool have not been treated in this way. The invention seeks to provide a fibrillated keratinous fibre fabric and a method of fibrillating natural fibres. A textile fabric of keratinous fibre is disclosed characterised by the presence of fibrils, micro-fibrils and proto-fibrils. The fibrils may be further characterised as having diameters in the range 3 mum to 5 mum and by having lengths in the range 25 mum to 60 mum. Preferably, the fabric is a woven, knitted, non-woven or composite fabric. A method of treating natural fibres is also disclosed which comprises:- a pre-treatment to remove surface lipid materials or scales, e.g. using an oxidising agent; a treatment to remove or partially remove intercellular cement, e.g. using an enzyme; and the application of mechanical agitation under aqueous conditions, e.g. hydroentanglement, to complete fibrillation.",RUSSELL STEPHEN J,RUSSELL STEPHEN J,,https://lens.org/139-808-552-554-611,Patent Application,yes,0,3,11,087-788-383-262-844;;111-894-151-520-557;;110-747-952-288-982;;086-773-389-158-61X;;167-641-161-753-65X;;076-996-401-258-054;;090-368-373-692-928;;178-128-036-576-940;;001-538-393-781-953;;126-715-158-671-364;;139-808-552-554-611,CN;;GB;;TW;;NZ;;EP;;AU;;WO;;US;;JP;;ZA,11,090-368-373-692-928;;086-773-389-158-61X;;110-747-952-288-982;;111-894-151-520-557;;167-641-161-753-65X;;076-996-401-258-054;;126-715-158-671-364;;001-538-393-781-953;;178-128-036-576-940;;139-808-552-554-611;;087-788-383-262-844,CN;;GB;;TW;;NZ;;EP;;AU;;WO;;US;;JP;;ZA,0,D06C29/00;;D06L1/12;;D06L1/16;;D06L1/20;;D06L4/40;;D06M10/025;;D06M11/30;;D06M11/50;;D06M11/84;;D06M13/364;;D06M13/52;;D06M16/003;;D06C29/00;;D06L1/12;;D06L1/16;;D06L1/20;;D06L4/40;;D06M10/025;;D06M11/30;;D06M11/50;;D06M11/84;;D06M13/364;;D06M13/52;;D06M16/003,D06C29/00;;D06L1/12;;D06L1/16;;D06L1/20;;D06L4/40;;D06M10/02;;D06M11/00;;D06M11/30;;D06M11/50;;D06M11/54;;D06M11/84;;D06M13/364;;D06M13/52;;D06M16/00;;D06M101/12,8/115.51,0,0,,,,DISCONTINUED
90,GB,A,GB 738687 A,129-546-598-584-138,1955-10-19,1955,GB 1251153 A,1953-05-05,IT 738687X A,1952-05-06,Improvements relating to textiles containing artificial fibres of protein,"Carded strands, tops, or ribbons, spun yarns or woven textiles composed of artificial protein fibres mixed with other fibres, are passed through at least one hot bath of plain water or of water containing a water-soluble neutral or acid salt. The fibres with which the artificial protein fibres may be mixed may be cotton, flax, silk, animal hair, nylon, Perlon, Rilsan, or artificial cellulosic fibres. The hot aqueous bath may comprise a water-soluble salt of ammonium, alkali metal or alkaline earth metal. The material may be treated under tension or in the relaxed condition and is dried in a relaxed condition. The bath may be at a temperature between 30 DEG and 100 DEG C. The fibres may be dyed before mixing. The process is said to cause frissures in the artificial protein fibres.",AMERICAN PATENTS CORP,,,https://lens.org/129-546-598-584-138,Granted Patent,no,0,0,5,143-514-100-114-456;;189-273-628-823-28X;;005-557-729-561-25X;;129-546-598-584-138;;060-161-601-650-433,FR;;LU;;GB;;BE;;NL,5,143-514-100-114-456;;189-273-628-823-28X;;005-557-729-561-25X;;129-546-598-584-138;;060-161-601-650-433,FR;;LU;;GB;;BE;;NL,0,D06M11/05,D06M11/05,,0,0,,,,EXPIRED
91,US,A1,US 2015/0065686 A1,151-052-167-772-687,2015-03-05,2015,US 201314391550 A,2013-04-02,GB 201205916 A;;GB 2013000148 W,2012-04-02,METHOD FOR MAKING A FIBRE COMPRISING NATURAL FIBRE NANOPARTICLES,"A method for making natural fibre products comprising embrittling natural fibres and breaking the embrittled fibres into nanoparticles, forming a suspension of the fibre nanoparticles in a spinnable liquid, and spinning fibre from the suspension. The method may be used to make fibres having the dimensions and properties of cashmere.",UNIV HERIOT WATT,STYLIOS GEORGE,HERIOT WATT UNIVERSITY (2014-11-25),https://lens.org/151-052-167-772-687,Patent Application,yes,4,6,7,031-246-486-169-388;;151-052-167-772-687;;154-769-346-487-520;;187-836-654-805-070;;035-083-764-195-28X;;020-974-892-773-085;;011-956-231-992-621,IN;;CN;;GB;;EP;;US;;WO,7,031-246-486-169-388;;151-052-167-772-687;;154-769-346-487-520;;187-836-654-805-070;;035-083-764-195-28X;;020-974-892-773-085;;011-956-231-992-621,IN;;CN;;GB;;EP;;US;;WO,0,D01F1/02;;D01F2/00;;D01F4/00;;D01D5/0046;;C07K14/78;;D01D5/06;;D01F1/02;;D01F2/00;;D01F4/00,D01D5/00;;C07K14/78;;D01D5/06,530/357;;264/176.1;;264/466;;530/353,9,7,089-117-180-125-861;;119-805-788-642-168;;090-790-536-915-035;;148-137-544-476-58X;;046-085-756-845-949;;107-948-162-489-379;;036-517-177-549-030,10.1016/j.powtec.2011.12.038;;10.1016/s0266-3538(03)00178-7;;10.1016/j.progpolymsci.2010.04.005;;10.1002/app.23810;;10.1016/j.polymer.2009.02.022;;10.1002/adma.200700896;;10.1007/bf02908152,"Patil et al., Powder Technology, online December 24, 2011, 219: 179-185.;;Huang et al., Composite Science and Technology, 2003, 63: 2223-2253.;;Hardy et al., Progress in Polymer Science, 2010, 35: 1093-1115.;;Iridag et al., J. Appl. Polymer Sci., 2006, 100: 4260-4264.;;Gandhi et al., Polymer, 2009, 50: 1918-1924.;;Cheng et al., AATCC Review, 2006, p. 41-43.;;Anitha et al., Carbohydrate Polymers, online 19 August 2011, 87: 1065-1072.;;Zhang et al., Adv. Mater., 2007, 19: 3664-3667.;;Lu et al., Fibers and Polymers, 2007, 8: 1-6",DISCONTINUED
92,CN,A,CN 105155029 A,138-509-104-884-768,2015-12-16,2015,CN 201510378741 A,2015-07-02,CN 201510378741 A,2015-07-02,Novel waterproof and breathable composite fiber textile material,"The invention discloses a novel waterproof and breathable composite fiber textile material, which is characterized by being prepared from the following raw materials by weight part: 40-60 of poultry feather, 14-17 of down, 1-3 of a silane coupling agent KH550, 1-2 of nano-silica, 1-2 of nano-silver, 14-20 of chitosan, 30-50 of polypropylene, 3-5 of kapok fiber, 0.5-1 of paraffin, 4-6 of bamboo pulp fiber, and a proper amount of water. The added kapok fiber, paraffin and bamboo pulp fiber greatly enhance the sterilizing, bacteriostatic, acarus removing, anti-ultraviolet, waterproof, breathable and other performance of composite fiber, and greatly improve the fiber quality. The preparation process involved in the invention has the advantages of simplicity, wide material sources, also greatly increases the utilization rate of waste feather, and reduces environmental pollution. The prepared textile material has good performance in all aspects, and is worth popularizing.",QINGYANG YUEYANG HOME SUPPLIES CO LTD,ZHANG ZHONGYOU,,https://lens.org/138-509-104-884-768,Patent Application,no,4,3,1,138-509-104-884-768,CN,1,138-509-104-884-768,CN,0,,D01F8/06;;D01F1/10;;D01F8/02;;D01F8/18,,0,0,,,,DISCONTINUED
93,JP,A,JP 2019011542 A,153-256-128-574-482,2019-01-24,2019,JP 2018118451 A,2018-06-22,JP 2017129123 A,2017-06-30,RAYON FIBER,"To provide: a rayon fiber which has excellent hygroscopicity, water absorption property and fast drying property, and can be used for various applications such as clothing such as gloves, underwear, socks, a shirt and dress, face masks, materials for disposable diapers and cosmetic sheets such as swiping cosmetic sheets; a textile fabric containing the rayon fiber; and a nonwoven fabric containing the rayon fiber.SOLUTION: The rayon fiber having moisture retention property is characterized by containing a polysaccharide from Aphanothece sacrum at a ratio of 0.01 to 0.5 pt.mass of the polysaccharide from Aphanothece sacrum per 100 pts.mass of rayon.SELECTED DRAWING: None",OMIKENSHI KK;;GREEN SCIENCE MAT INC;;ROYNE CO LTD,TOKUDA HIROSHI;;KANEKO SHINICHIRO;;UEMURA TAKUJI,,https://lens.org/153-256-128-574-482,Patent Application,no,5,2,4,153-256-128-574-482;;194-910-370-771-397;;161-076-612-987-07X;;164-155-276-529-612,CN;;JP,4,153-256-128-574-482;;194-910-370-771-397;;161-076-612-987-07X;;164-155-276-529-612,CN;;JP,0,D01F2/10;;D03D15/00;;D04B1/14;;D04H3/013;;D10B2201/24,D01F2/10;;D03D15/00;;D04B1/16;;D04H1/4258,,0,0,,,,ACTIVE
94,DE,A1,DE 2052553 A1,154-041-678-766-348,1972-05-04,1972,DE 2052553 A,1970-10-27,AT 1040269 A,1969-11-05,Manufacture of yarns from hard fibres,"Manufacture of yarns from hard fibres, esp. sisal, with a 'flame' effect produced on hard fibre spinning machines comprises introducing a rubbed pre-yarn (loosely spun yarn) into the spun strip (sliver) of long staple fibres near the drawing equipment of the spinning machine, the average staple length of the yard fibres being a multiple of the length of the added yarns, the preferred ratio of fibre lengths of added to hard fibre being 1:8.",,,,https://lens.org/154-041-678-766-348,Patent Application,no,0,0,3,011-069-498-275-655;;154-041-678-766-348;;154-466-520-297-24X,DE;;AT;;NL,3,011-069-498-275-655;;154-041-678-766-348;;154-466-520-297-24X,DE;;AT;;NL,0,D02G3/34,D02G3/34,,0,0,,,,DISCONTINUED
95,CN,A,CN 1370872 A,170-408-711-049-729,2002-09-25,2002,CN 01106890 A,2001-02-23,CN 01106890 A,2001-02-23,Ramie aramid fibre scribbled and its finishing process,"The ramie aramid fibre scribbled is spun through spinning the mixture of ramie fiber in 10-90 % and Fanglun fiber. Its size is 27-42 texX3. Its finishing process includes separate carding of ramite fiber and Fanglun fiber, thrice drawing, slubbing, mixing, fine spinning, electric finishing, and twisting. The present invention can be used to produce cigarette rolling belt, which has high strength,high wear resistance and no static electricity and may be used for replacing cigarette rolling belt of chemical fiber with static electricity and higher temperature rise.",HUNAN RAMIE TECHN RES CT,JIN YONGLU;;CHEN XIUYING;;LI SHOUXIN,,https://lens.org/170-408-711-049-729,Patent Application,no,0,7,2,194-570-281-922-79X;;170-408-711-049-729,CN,2,194-570-281-922-79X;;170-408-711-049-729,CN,0,,D02G3/04,,0,0,,,,EXPIRED
96,CN,U,CN 205386961 U,178-805-666-321-606,2016-07-20,2016,CN 201521079803 U,2015-12-22,CN 201521079803 U,2015-12-22,Silk compound fabric with it is cold -proof frivolous,"The utility model relates to the field of textile technology, specific saying is a silk compound fabric with it is cold -proof frivolous, silk composite fiber's surface is equipped with the hotness fibre, the fibrous inside of hotness is equipped with the bleeder vent, the fibrous surface of hotness is equipped with mercerized wool composite fiber, silk composite fiber is by the silk fibre, bamboo charcoal fiber, the duck's down is fibrous, bamboo charcoal fiber inlays respectively with the fibrous inside of duck's down and is equipped with the silk fibre, bamboo charcoal fiber forms silk composite fiber with crossing the twining of duck's down fibre, mercerized wool composite fiber is by the mercerized wool, quartzy oriental cherry shape fibre and chitin are fibrous, also quartzy oriental cherry shape fibre is wrapped up in the outside of mercerized wool, quartzy oriental cherry shape fibre outside parcel has the chitin fibre, the utility model discloses a bamboo charcoal fiber increased antibiotic layer, utilized quartzy oriental cherry shape fibre to replace the silk fibre simultaneously, reduced the manufacturing cost of fabric, duck's down fibre and mercerized wool be both for fabric increase warmth retention property simultaneously, can not increase the weight of fabric again.",SHANGHAI SILK (GROUP) BRAND DEV CO LTD,LI LUN,,https://lens.org/178-805-666-321-606,Limited Patent,no,0,1,1,178-805-666-321-606,CN,1,178-805-666-321-606,CN,0,,B32B9/02;;B32B9/00,,0,0,,,,INACTIVE
97,CN,A,CN 116288869 A,008-080-019-414-195,2023-06-23,2023,CN 202310281622 A,2023-03-22,CN 202310281622 A,2023-03-22,Down jacket fabric with nanometer self-cleaning function,"The invention discloses a down jacket fabric with a nano self-cleaning function. The down jacket fabric is obtained by warp and weft knitting of composite yarns prepared by blending modified kapok fiber yarns and polyamide fiber yarns, wherein the kapok fibers are subjected to pulping treatment to obtain kapok fiber slurry; modified nano titanium dioxide powder prepared after modification treatment of 2, 3-epoxypropyltrimethylammonium chloride and dioctyl sodium sulfosuccinate is added into the kapok fiber slurry, and modified kapok fiber slurry is obtained; and adding the modified kapok fiber slurry into an electrostatic spinning solvent, and preparing the modified kapok fiber yarn by adopting electrostatic spinning equipment. According to the down jacket fabric with the nano self-cleaning function, the modified nano-scale titanium dioxide powder is added into the kapok fiber slurry, so that the textile fabric can still keep a good self-cleaning effect after being washed for multiple times; the durability of the self-cleaning effect is guaranteed, meanwhile, the anti-pilling performance and the color fastness to water of the fabric are improved, and the application requirement of the fabric is met.",ANHUI GAOFAN E COMMERCE CO LTD,WU KUNMING;;ZHANG CHUANGUI;;ZHAO CHUANSHU;;GAO JINA,,https://lens.org/008-080-019-414-195,Patent Application,no,0,0,1,008-080-019-414-195,CN,1,008-080-019-414-195,CN,0,D03D15/47;;D01F1/10;;D01F2/00;;D03D15/225;;D03D15/283;;D03D15/50;;D10B2201/22;;D10B2331/02;;Y02P70/62,D03D15/47;;D01F1/10;;D01F2/00;;D03D15/225;;D03D15/283;;D03D15/50,,0,0,,,,PENDING
98,CN,A,CN 102677342 A,025-925-477-755-956,2012-09-19,2012,CN 201210169062 A,2012-05-29,CN 201210169062 A,2012-05-29,Textile fabric,"The invention discloses textile fabric. Warps are made of jute fibers, and wefts are made of polynosic. The diameter of every jute fiber is 56.73mu m, the fineness of the jute fibers is 651dtex, the diameter of the polynosic is 63.88mu m, the fineness of the polynosic is 492dtex, the warp density is 25.7pcs/cm, and the weft density is 9.3pcs/cm. The textile fabric is reasonable in structure, good in using performance and capable of enabling consumers with special needs to be satisfied.",ZILIN CAI,ZILIN CAI,,https://lens.org/025-925-477-755-956,Patent Application,no,3,1,1,025-925-477-755-956,CN,1,025-925-477-755-956,CN,0,,D03D13/00;;D03D15/217;;D03D15/225,,3,0,,,"李智慧: ""丽赛纤维面料的开发"", 《济南纺织化纤科技》;;刘东升等: ""黄麻纤维的产业状况及其应用进展"", 《纺织科技进展》;;彭文芳: ""黄麻纤维的性能及服用织物开发前景"", 《山东纺织科技》",DISCONTINUED
