170,GB,A,GB 561248 A,150-644-888-451-624,1944-05-11,1944,GB 1570942 A,1942-11-06,GB 1570942 A,1942-11-06,Improvements relating to resilient cushioning materials,"561,248. Compound sheet' materials. SWAINE, A. E., and FIRTH & SONS, Ltd., T. F. Nov. 6, 1942, No. 1.5709. [Class 140]. Resilient cushioning material suitable for filling cushions, seats, and other articles of furniture comprises a number of uncut double plush cloths a, b, c'superimposed and interconnected by thread, cord or like ties d at spaced intervals. An adhesive containing rubber, rubber latex, cellulose acetate, or a resin may be applied to the ties, and, if desired, also to the parts of the fabric immediately surrounding the ties to prevent chafing of the fabric. Each individual double plush cloth may comprise a pile of mohair, worsted, alpaca, camel hair, or other natural or artificial resilient fibre woven into and between two foundation fabrics of cotton warps and wefts. Intermediate layers of other textile material may be incorporated.",ARTHUR EDWIN SWAINE;;T W FIRTH & SONS LTD,,,https://lens.org/150-644-888-451-624,Granted Patent,no,0,0,1,150-644-888-451-624,GB,1,150-644-888-451-624,GB,0,B68G11/03;;A47C31/026;;D03D27/00,A47C31/02;;B68G11/03;;D03D27/00,,0,0,,,,EXPIRED
171,CN,U,CN 219777314 U,150-830-312-439-023,2023-09-29,2023,CN 202320652814 U,2023-03-29,CN 202320652814 U,2023-03-29,Cotton textile tensile test equipment,"The utility model relates to the technical field of cotton textile tensile test, and particularly provides cotton textile tensile test equipment which comprises a base, a bidirectional screw rod which penetrates through a U-shaped block is rotatably connected to the inner side of a connecting groove, and connecting blocks which are in sliding connection with the connecting groove are symmetrically screwed to the outer side of the bidirectional screw rod. And clamping blocks are fixedly mounted on the opposite surfaces of the two connecting blocks which correspond to each other up and down. According to the utility model, the operation block is rotated to drive the bidirectional screw rod connected with the operation block to rotate, so that the two connecting blocks on the outer side drive the clamping blocks to move towards opposite directions, and therefore, a cotton textile is fixed at the central positions of the first clamping mechanism and the second clamping mechanism, and the stress direction of a tensile test cannot be decomposed; the technical problems that in the prior art, when a cotton textile tensile test device is actually used, the cotton textile is fixed to a clamp in an adjusting mode, the position of the clamp deviates to one side, stress of the tensile test cotton textile is decomposed, and precision is affected are solved.",ZHI LIYING;;SHI JIA;;XING YANWEI;;DONG CHENGUANG,ZHI LIYING;;SHI JIA;;XING YANWEI;;DONG CHENGUANG,,https://lens.org/150-830-312-439-023,Limited Patent,no,0,0,1,150-830-312-439-023,CN,1,150-830-312-439-023,CN,0,,G01N3/04;;G01N3/08,,0,0,,,,ACTIVE
172,CN,A,CN 109095580 A,144-134-887-707-483,2018-12-28,2018,CN 201811070345 A,2018-09-13,CN 201811070345 A,2018-09-13,Recycling method of waste cotton textiles,"The invention belongs to the technical field of recycling of textiles and particularly relates to a recycling method of waste cotton textiles. The provided recycling method of the waste cotton textiles comprises the following steps: (1) processing the waste cotton textiles at the front end; (2) chemically dissolving the waste cotton textiles; and (3) preparing a cellulose base flocculant; meanwhile, the prepared flocculant is widely applied to the technical fields like sewage treatment, has the prominent advantages of simple use operation, relatively low use cost, quite obvious effect, safetyand environment protection, is poisonless and harmless, and does not cause secondarily pollution, the turbidity of water is effectively reduced, the contents of organic matters and heavy metals in thewater are reduced, and the flocculant is widely applied to the treatment of domestic water, papermaking sewage and sewage of a coal mine.",SHISHI ZHONGFANGXUE CLOTHES AND ACCESSORY INDUSTRIAL RES INSTITUTE,ZHENG FU'ER;;CAI TAO;;WU QIULAN;;DENG MENGYING;;WU ZHONGXIAN;;LI JIANNI;;CHEN MEIYING,,https://lens.org/144-134-887-707-483,Patent Application,no,4,0,1,144-134-887-707-483,CN,1,144-134-887-707-483,CN,0,C02F1/56,C02F1/56,,4,0,,,"何小维等: ""《医药用碳水化合物》"", 31 January 2016, 中国轻工业出版社;;刘文: ""《药用高分子材料学》"", 30 June 2017, 中国中医药出版社;;金旭: ""疏水可控纤维素基絮凝材料制备及其形成污泥性能研究"", 《中国优秀硕士学位论文全文数据库 工程科技I辑》;;许冬生: ""《纤维素衍生物》"", 31 January 2001, 化学工业出版社",DISCONTINUED
173,CA,A,CA 1056109 A,157-755-280-135-208,1979-06-12,1979,CA 231481 A,1975-07-15,CH 1009274 A,1974-07-22,METHOD OF MAKING YARNS FROM ANGORA RABBIT'S WOOL,"Yarn of a fineness between Nm 60 and Nm 250 comprises fibres from the fur of angora rabbits. The fibres are pretreated with a two-component composition of an antistatic agent and an agent for increasing the adhesability of the fibres. The pretreated fibres, with synthetic fibres, are spun together with an uninterrupted carrier thread of a cross-section up to one third of the cross-section of the spun yarn.",PATENTVERWERTUNG AG,EGBERS GERHARD;;ARTZT PETER,,https://lens.org/157-755-280-135-208,Granted Patent,no,0,0,41,161-370-551-699-505;;157-755-280-135-208;;175-684-813-096-510;;065-773-868-897-522;;099-636-919-936-011;;190-088-968-803-868;;099-330-728-627-513;;032-112-764-378-36X;;061-814-024-909-004;;169-357-320-258-125;;007-866-468-097-760;;065-907-951-620-736;;098-161-113-986-789;;011-209-238-857-829;;078-963-510-446-224;;118-111-248-766-722;;152-780-206-091-051;;121-592-285-865-613;;100-980-322-836-807;;076-030-794-874-425;;068-699-525-783-693;;181-990-691-559-283;;040-597-183-817-967;;028-990-046-476-234;;016-408-069-480-226;;081-178-275-885-554;;162-600-057-200-112;;176-544-405-789-248;;025-114-641-856-515;;049-982-565-482-443;;045-121-156-808-975;;034-037-936-880-221;;167-277-072-241-056;;153-528-328-712-233;;167-944-820-257-771;;092-348-035-178-234;;059-189-175-170-996;;179-466-551-372-262;;057-630-682-722-910;;146-708-975-261-891;;149-704-016-295-00X,IE;;IT;;IL;;US;;JP;;FI;;HK;;BR;;DK;;BE;;AU;;AT;;ZA;;CH;;LU;;AR;;DE;;SE;;NL;;FR;;IN;;ES;;GB;;NO;;CA,41,161-370-551-699-505;;157-755-280-135-208;;175-684-813-096-510;;065-773-868-897-522;;099-636-919-936-011;;190-088-968-803-868;;099-330-728-627-513;;032-112-764-378-36X;;061-814-024-909-004;;169-357-320-258-125;;007-866-468-097-760;;065-907-951-620-736;;098-161-113-986-789;;011-209-238-857-829;;078-963-510-446-224;;118-111-248-766-722;;152-780-206-091-051;;121-592-285-865-613;;100-980-322-836-807;;076-030-794-874-425;;068-699-525-783-693;;181-990-691-559-283;;040-597-183-817-967;;028-990-046-476-234;;016-408-069-480-226;;081-178-275-885-554;;162-600-057-200-112;;176-544-405-789-248;;025-114-641-856-515;;049-982-565-482-443;;045-121-156-808-975;;034-037-936-880-221;;167-277-072-241-056;;153-528-328-712-233;;167-944-820-257-771;;092-348-035-178-234;;059-189-175-170-996;;179-466-551-372-262;;057-630-682-722-910;;146-708-975-261-891;;149-704-016-295-00X,IE;;IT;;IL;;US;;JP;;FI;;HK;;BR;;DK;;BE;;AU;;AT;;ZA;;CH;;LU;;AR;;DE;;SE;;NL;;FR;;IN;;ES;;GB;;NO;;CA,0,D02G3/04;;Y10S57/901;;D02G3/04;;Y10S57/901,D02G3/04,8-93.15,0,0,,,,EXPIRED
174,CN,A,CN 103882571 A,164-814-606-755-361,2014-06-25,2014,CN 201210556581 A,2012-12-19,CN 201210556581 A,2012-12-19,Linen blended yarn and fabric with shrink proof function and textile process thereof,"The invention relates to a linen blended textile with a shrink proof function and a textile process thereof. The textile comprises yarns and fabrics. Raw materials of a linen blended yarn with the shrink proof function include, by weight: 25 to 45 parts of hemp fiber, 40 to 60 parts of flax fiber and 10 to 25 parts of modal fiber. The modal fiber is pre-sanforized. A linen blended fabric is formed by spinning the linen blended yarns. The linen blended yarn and fabric has the advantages of antibacterial and anti-mildew capabilities, moisture absorption and breathability, ultraviolet resistance, high drapability and the like.",LUOLAI HOME TEXTILE CO LTD,XU ZHAOMEI;;XIAO AILI;;NI RONG;;XU LIANGPING,,https://lens.org/164-814-606-755-361,Patent Application,no,0,8,1,164-814-606-755-361,CN,1,164-814-606-755-361,CN,0,,D02G3/04;;D03D15/217;;D03D15/225;;D03D15/47,,0,0,,,,DISCONTINUED
175,EP,A1,EP 0420724 A1,174-504-220-729-039,1991-04-03,1991,EP 90402589 A,1990-09-19,FR 8912638 A,1989-09-27,Composite textile fibre based on angora rabbit fur for articles of clothing and underclothing.,"Yarn consisting of a carding of chlorofibres, of acrylic fibres and of nonrugged angora wool fibres. The yarn thus produced exhibits high softness and warmth qualities. Application: manufacture of clothing and of underclothing.",SARL MARJOLAINE,SEILLON JEAN-MARIE,,https://lens.org/174-504-220-729-039,Patent Application,yes,3,2,2,174-504-220-729-039;;106-456-526-295-608,FR;;EP,2,174-504-220-729-039;;106-456-526-295-608,FR;;EP,0,D02G3/04,D02G3/04,,0,0,,,,DISCONTINUED
176,CN,Y,CN 2569680 Y,178-030-021-119-266,2003-09-03,2003,CN 02275368 U,2002-09-20,CN 02275368 U,2002-09-20,Health jute carpet,"The utility model belongs to the technical field of textile, wherein, the use surface of a carpet is a jute layer; two layers of bottom layers are arranged under the jute layer. The utility model has the outstanding advantages of fast moisture suction and moisture discharge, strong bacteriostasis and bacteria resistance, no static electricity, no foreign odor, no secondary pollution to indoors and natural environment, and comfortable use, and furthermore, the utility model is a pure natural environmental protection product, and the price of the utility model is only one half of the price of a pure wool carpet.",GAO ZHANKUI,GAO ZHANKUI,,https://lens.org/178-030-021-119-266,Limited Patent,no,0,2,1,178-030-021-119-266,CN,1,178-030-021-119-266,CN,0,,A47G27/02,,0,0,,,,EXPIRED
177,CN,A,CN 101984166 A,178-079-342-133-787,2011-03-09,2011,CN 201010558980 A,2010-11-25,CN 201010558980 A,2010-11-25,Nano silver bioactivity composite fibre fabric,"Aiming at the problems in the prior art that common soybean fiber fabric is easy to carry static electricity and difficult to spin, and the common fibre fabric has non-durable bioactivity and poor washing resistance, the invention discloses a nano silver bioactivity composite fibre fabric, which comprises surface tissue and inner tissue, wherein the surface tissue of the fabric is formed by interweaving warp yarn composed of soybean fibers and weft yarn composed of low-temperature shrinkage fibre, and the mass ratio of the warp yarn to the weft yarn is 85:35; the inner tissue is formed by interweaving warp yarn composed of chitosan fibre and weft yarn composed of high-temperature shrinkage fibre, and the mass ratio of the warp yarn to the weft yarn is 64:36; and superfine conductive fibre with nano silver is interweaved between the surface tissue and the inner tissue plated. The fabric of the invention is characterized in that compound spinning is carried out on the biodegradable soybean fibre, chitosan fibre and byssus active fiber according to a certain structure form, so that the fabric is comfortable to wear, has functions of radiation protection, antibiosis, static electricity removal and washing, rinsing resistance and excellent bioactivity and is biodegradable.",TAIZHOU CITY ZHONGYI NOVEL TEXTILE TECHNOLOGY CO LTD,YIPING SUN,,https://lens.org/178-079-342-133-787,Patent Application,no,0,2,1,178-079-342-133-787,CN,1,178-079-342-133-787,CN,0,,D03D13/00;;D03D15/20;;D03D15/233;;D03D15/33;;D03D15/50,,0,0,,,,DISCONTINUED
178,CN,U,CN 220069010 U,199-299-124-935-729,2023-11-24,2023,CN 202321584758 U,2023-06-21,CN 202321584758 U,2023-06-21,Super-flexible textile vamp,"The utility model discloses an ultra-flexible textile vamp, which relates to the textile field, and comprises a fabric body, a polyester fiber layer, a sweat absorbing layer, a flexible layer, a breathable layer and a flax layer, the fabric body is a woven vamp whole body, and the fabric body sequentially comprises the polyester fiber layer, the sweat absorbing layer, the flexible layer, the breathable layer and the flax layer from the top of the vamp to the bottom; the flexible layer comprises polyester shrinkage filaments and elastic fiber filaments, the polyester shrinkage filaments and the elastic fiber filaments are woven in a crossed mode, the sweat absorbing layer is woven by bamboo charcoal fiber filaments, and the breathable layer is woven by pure cotton threads in a staggered mode. The elasticity and the flexibility of the vamp cloth are enhanced through the polyester shrinkage yarn and the elastic fiber yarn, meanwhile, sweat at the bottom of the vamp is stably absorbed through the sweat absorption layer, the physical performance of supporting of the vamp is improved through the breathable layer and the flax layer, meanwhile, the breathability of the vamp is improved, the perspiration and breathability capacity of a shoe body is enhanced, and the service life of the vamp is prolonged. The vamp cloth is more stable, and the practicability is high.",PUTIAN HUAJIN TEXTILE CO LTD,WANG JINFU,,https://lens.org/199-299-124-935-729,Limited Patent,no,0,0,1,199-299-124-935-729,CN,1,199-299-124-935-729,CN,0,,A43B23/02;;D04B1/16;;D04B1/18;;D04B1/24;;D04B21/00;;D04B21/20,,0,0,,,,ACTIVE
179,CN,A,CN 102443955 A,196-569-632-927-969,2012-05-09,2012,CN 201110335309 A,2011-10-31,CN 201110335309 A,2011-10-31,Ramie knitted fabric,"The invention discloses a ramie knitted fabric, comprising ramie blended yarns formed by blending ramie fibres and other fibres according to a certain ratio, wherein the other fibres comprise one or two of terylene fibres, tencel fibres, corn fibres and chinlon fibres; the ratio of the blending percentages by weight of the ramie fibres to the other fibres is 20-35%: 65-80%; and the specification of the ramie blended yarns is 20-42 yarns/2, and the twist coefficient is 560-700. Fibre ingredients with a good toughness such as corn fibres, tencel fibres and terylene fibres are variously combined, matched and blended with ramie fibres in the invention via the method aforementioned, so as to weaken the rigidity of the blended yarns and enhance the feasibility of the yarns for knitted fabric ramie; and the service ability problems such as strong prickle sensation and bad wrinkle resistance of a fabric are improved in a precondition of ensuring the various excellent performances of ramie.",SUZHOU CHUANGYU WEAVING CO LTD,LIFANG MA,,https://lens.org/196-569-632-927-969,Patent Application,no,7,7,1,196-569-632-927-969,CN,1,196-569-632-927-969,CN,0,,D04B1/14;;D02G3/04;;D04B1/12,,5,0,,,"王正东等: ""天丝/麻混纺气流纱的研制"", 《江苏纺织》;;曹云娜等: ""涤纶对天丝苎麻织物的性能影响"", 《针织工业》;;罗小芹等: ""不同混纺比天丝/苎麻混纺纱的性能研究"", 《上海纺织科技》;;蒋国华: ""混纺比与涤/麻混纺纱性能关系探讨"", 《纺织学报》;;郁崇文等: ""《苎麻纱线生产工艺与质量控制》"", 31 August 1997, 中国纺织大学出版社",DISCONTINUED
180,CN,U,CN 219338833 U,193-570-652-447-574,2023-07-14,2023,CN 202320410560 U,2023-03-07,CN 202320410560 U,2023-03-07,Gel-containing home textile and clothing filler,"The utility model discloses a home textile and clothing filler containing gel, which comprises a filler component, the filler component comprises a gel layer, two sides of the gel layer are respectively provided with a jute fiber layer I and a jute fiber layer II, the opposite surfaces of the jute fiber layer I and the jute fiber layer II are fixed on two sides of the gel layer in a hot-pressing compounding manner, and the gel layer is arranged on the gel layer. A first carbon fiber layer is arranged on the face, away from the gel layer, of the first fibrilia layer, the face, facing the gel layer, of the first carbon fiber layer is fixed to the first fibrilia layer in a hot-pressing compounding mode, and a second carbon fiber layer is arranged on the side, away from the gel layer, of the second fibrilia layer. The face, facing the gel layer, of the second carbon fiber layer is fixed to the second fibrilia layer in a hot-pressing compounding mode, and the side, away from the first fibrilia layer, of the first carbon fiber layer is provided with a first waterproof layer. The gel-containing home textile and garment filler is reasonable in structure, the heat insulation and warm keeping effect can be conveniently improved, and practicability is high.",ZHEJIANG ALLANLEE NEW MAT CO LTD,SUN FUSHENG,,https://lens.org/193-570-652-447-574,Limited Patent,no,0,0,1,193-570-652-447-574,CN,1,193-570-652-447-574,CN,0,Y02W90/10,B32B9/02;;B32B9/04;;B32B33/00,,0,0,,,,ACTIVE
181,CN,U,CN 208121288 U,006-294-704-931-407,2018-11-20,2018,CN 201820120448 U,2018-01-24,CN 201820120448 U,2018-01-24,Antibiotic waterproof antistatic imitative rabbit hair circle loop yarn,"The application discloses antibiotic waterproof antistatic imitative rabbit hair circle loop yarn including the heart yearn, has the imitative rabbit hair to draw the wool yarn in the winding of heartyearn periphery spiral, still includes the static line, and the skin of heart yearn is antibiotic coat, the imitative rabbit hair draws the wool yarn to include that yarn core and winding are in justthrough drawing the knitting yarn of the imitative rabbit hair behind the hair, the yarn core adopts chitin fibre long filament and/or the twisting of antibiotic nylon filament more than two to makearound the yarn core, the imitative knitting yarn of the rabbit hair is formed by imitative rabbit hair polyamide fiber, polyamide fibre fibre and the fibrous blending of acrylic fibres, the imitativeknitting yarn surface of rabbit hair coating has the antistatic layer, and the coating has the waterproof layer on the antistatic layer. The imitative rabbit hair draws wool yarn soft handle, and isfluffy, utilizes the imitative rabbit hair to draw the wool yarn to make imitative rabbit hair circle loop yarn, can strengthen yarn surface's third dimension, improves the fluffy looseness that feels. Anti electrostatic coating layer, waterproof layer, antibiotic coat make imitative rabbit hair circle loop yarn possess better service function, enlarge the practicality.",JIANGSU JIUZHOU TEXTILE CO LTD,DONG JIANG,,https://lens.org/006-294-704-931-407,Limited Patent,no,0,3,1,006-294-704-931-407,CN,1,006-294-704-931-407,CN,0,,D02G3/34,,0,0,,,,ACTIVE
182,CN,A,CN 106835405 A,006-757-692-666-412,2017-06-13,2017,CN 201610998135 A,2016-11-14,CN 201610998135 A,2016-11-14,Moldproof and deodorant regenerated cotton yarn textile material containing kapok fiber and used for towel and preparing method thereof,"The invention discloses a moldproof and deodorant regenerated cotton yarn textile material containing kapok fiber and used for a towel. The moldproof and deodorant regenerated cotton yarn textile material is prepared from, by weight, 60-80 parts of all-cotton cloth strip, 15-25 parts of polyester-mixed cotton cloth strip with the cotton content of 40-60%, 5-10 parts of kapok fiber, 3-5 parts of silica sol, 5-10 parts of soluble starch, 2-4 parts of polyvinyl alcohol, 0.5-1 part of aloe vera gel, 0.3-0.5 part of pectin, 0.5-1 part of sodium alginate and 0.1-0.15 part of ascorbic acid. The moldproof and deodorant regenerated cotton yarn textile material has good hygiene, comfort, strength and durability, has the moldproof and deodorant effects and is suitable for towel processing.",ANHUI TIANZHU TEXTILE TECH CO LTD,LI FEI,,https://lens.org/006-757-692-666-412,Patent Application,no,7,0,1,006-757-692-666-412,CN,1,006-757-692-666-412,CN,0,D02G3/04;;A47K10/02;;D06M11/79;;D06M15/03;;D06M15/11;;D06M15/333;;D06M16/00;;D06M2101/06;;D06M2101/32;;D10B2201/01;;D10B2201/02;;D10B2331/04;;D10B2401/063;;D10B2503/00,D02G3/04;;A47K10/02;;D06M11/79;;D06M15/03;;D06M15/11;;D06M15/333;;D06M101/06;;D06M101/32,,0,0,,,,DISCONTINUED
183,US,A1,US 2018/0360666 A1,029-483-754-477-465,2018-12-20,2018,US 201816111362 A,2018-08-24,US 201816111362 A;;US 201213620077 A;;US 201213411024 A;;US 65067007 A;;US 75826106 P,2006-01-11,Hemostatic Textile,"The present invention is directed to a hemostatic textile, comprising: a material comprising a combination of glass fibers and one or more secondary fibers selected from the group consisting of silk fibers; ceramic fibers; raw or regenerated bamboo fibers; cotton fibers; rayon fibers; linen fibers; ramie fibers; jute fibers; sisal fibers; flax fibers; soybean fibers; corn fibers; hemp fibers; lyocel fibers; wool; lactide and/or glycolide polymers; lactide/glycolide copolymers; silicate fibers; polyimide fibers; feldspar fibers; zeolite fibers, zeolite-containing fibers, acetate fibers; and combinations thereof; the hemostatic textile capable of activating hemostatic systems in the body when applied to a wound. Additional cofactors such as thrombin and hemostatic agents such as RL platelets, RL blood cells; fibrin, fibrinogen, and combinations thereof may also be incorporated into the textile. The invention is also directed to methods of producing the textile, and methods of using the textile to stop bleeding.",UNIV NORTH CAROLINA CHAPEL HILL;;ENTEGRION INC,FISCHER THOMAS H;;ESKRIDGE E STAN;;MALLOY WILLIAM M;;EVANS MALLOY,THE UNIVERSITY OF NORTH CAROLINA AT CHAPEL HILL (2007-03-22);;ENTEGRION INC (2007-03-22),https://lens.org/029-483-754-477-465,Patent Application,yes,3,0,41,050-424-299-772-737;;175-072-586-565-753;;090-875-284-650-984;;122-823-209-785-453;;092-843-045-571-863;;156-530-234-971-447;;055-106-855-478-140;;043-059-840-048-776;;167-100-666-732-828;;008-639-960-494-369;;095-054-817-634-076;;018-088-254-533-951;;193-783-578-475-348;;066-707-251-052-598;;175-807-597-453-217;;016-492-500-825-071;;058-113-368-416-692;;093-866-454-821-075;;054-309-533-368-559;;120-323-075-654-226;;071-238-447-035-978;;051-796-847-049-675;;000-972-713-031-242;;029-483-754-477-465;;009-743-582-519-819;;175-996-683-084-484;;027-925-432-545-536;;193-707-731-110-421;;177-963-398-725-862;;155-499-521-415-153;;124-771-939-304-077;;122-344-303-945-910;;036-340-321-917-643;;044-944-896-417-786;;010-463-650-203-517;;035-430-440-129-925;;098-885-329-575-659;;004-528-084-480-137;;151-348-567-352-30X;;073-006-874-578-395;;076-079-673-618-035,CN;;ES;;MY;;CA;;EP;;AU;;MX;;KR;;US;;WO;;JP,41,175-072-586-565-753;;050-424-299-772-737;;090-875-284-650-984;;122-823-209-785-453;;092-843-045-571-863;;156-530-234-971-447;;055-106-855-478-140;;043-059-840-048-776;;167-100-666-732-828;;008-639-960-494-369;;095-054-817-634-076;;018-088-254-533-951;;193-783-578-475-348;;066-707-251-052-598;;175-807-597-453-217;;016-492-500-825-071;;058-113-368-416-692;;093-866-454-821-075;;051-796-847-049-675;;054-309-533-368-559;;071-238-447-035-978;;000-972-713-031-242;;120-323-075-654-226;;029-483-754-477-465;;009-743-582-519-819;;175-996-683-084-484;;027-925-432-545-536;;193-707-731-110-421;;177-963-398-725-862;;155-499-521-415-153;;124-771-939-304-077;;044-944-896-417-786;;036-340-321-917-643;;122-344-303-945-910;;010-463-650-203-517;;035-430-440-129-925;;098-885-329-575-659;;004-528-084-480-137;;151-348-567-352-30X;;073-006-874-578-395;;076-079-673-618-035,CN;;ES;;MY;;CA;;EP;;AU;;MX;;KR;;US;;WO;;JP,0,A61L15/18;;A61L15/28;;A61L15/42;;A61L2400/04;;A61P7/04;;Y10T442/30;;Y10T442/40;;A61L15/00;;A61K9/70;;A61F13/01042;;A61F13/01012;;A61F13/01017;;A61F2013/00089;;A61F2013/00463;;A61K36/899;;A61L15/16;;A61L15/18;;A61L15/20;;A61L15/42;;A61L2400/04;;C08K7/14;;D02G3/18;;Y10T442/30;;Y10T442/40,A61F13/00;;A61K36/899;;A61L15/16;;A61L15/18;;A61L15/20;;A61L15/42;;C08K7/14;;D02G3/18,,0,0,,,,ACTIVE
184,CN,U,CN 217319563 U,025-717-704-953-295,2022-08-30,2022,CN 202220402954 U,2022-02-24,CN 202220402954 U,2022-02-24,Anti-pilling flax blended fabric,"The utility model discloses an anti-pilling flax blended fabric, which relates to the technical field of textiles, aims to solve the problem that the fabric is easy to pilling, and adopts the technical scheme that the anti-pilling flax blended fabric comprises two mutually symmetrical surface layers, a conductive layer is fixedly connected between the two surface layers, a plurality of conductive velvet are arranged on two sides of the conductive layer, a plurality of through holes are formed in the surface layers, and the through holes are formed in the surface layers. The conductive velvet extends into the through holes, the length of the conductive velvet is smaller than the depth of the through holes, the copper fibers are arranged, the copper fibers have a good conductive effect, the conductive effect of the conductive layer is guaranteed, static electricity can be led out, the antistatic effect of the whole fabric is guaranteed, and huddling caused by static electricity between fibers is reduced; therefore, the anti-pilling purpose is achieved.",WUJIANG ZHENZE HUIYUAN SILK SPINNING CO LTD,SHEN XINMIN;;SHEN GUOMIN;;GU JIANHUA,,https://lens.org/025-717-704-953-295,Limited Patent,no,0,0,1,025-717-704-953-295,CN,1,025-717-704-953-295,CN,0,,B32B3/08;;B32B3/24;;B32B9/02;;B32B9/04;;B32B15/02;;B32B15/085;;B32B15/09;;B32B15/20;;B32B23/02;;B32B23/08;;B32B27/02;;B32B27/08;;B32B27/32;;B32B27/34;;B32B27/36,,0,0,,,,ACTIVE
